Mship No,Company Name,Address,Name,Ph (Off),Email,Business Sector(s),Business Speciality
NEW-756,ESCORTS (PAKISTAN) LTD.,28 KM MULTAN ROAD,,844523,,ELECTRIC METERS,ELECTRIC METERS
NEW-757,ESSA ENGINEERING COMPANY (PVT) LTD,113/4 INDUSTRIAL AREA TOWN SHIP,,5150825,,ELECTRIC METERS,ELECTRIC METERS
NEW-758,SB ELECTRONICS ENGINEERING & CONTROL (PVT) LTD.,31-KM FEROZEPUR ROAD,,"5274112-3, 7532260-61",,ELECTRIC METERS,ELECTRIC METERS
NEW-759,SYED BHAIS (PVT) LTD.,200-FEROZEPUR ROAD,,7589197-9,,ELECTRIC METERS,ELECTRIC METERS
NEW-760,BAIG ELICTICAL COMPANY (PTV) LTD,2 K.M KATAR BUND ROAD THOKAR NIAZ BAIG,,5420217,,ELECTRIC TRANSFORMERS,TRANSFORMERS
NEW-761,ELECTRO SERVICE INDUSTRIES,(PVT)  LTD 8-WINDSOR PARK ICHHRA,,7560534,,ELECTRIC TRANSFORMERS,TRANSFORMERS
NEW-762,ELMETEC (PVT) LTD.,", 19 KM., FEROZEPUR ROAD",,5800042-6,,ELECTRIC TRANSFORMERS,TRANSFORMERS
NEW-763,HAMMAD AND COMPANY 162 MOZAMMAL TOWN OPP: WAPDA GRID MULTAN ROAD,,,"7510463, 7510463
www.hammadco.com",,ELECTRIC TRANSFORMERS,TRANSFORMERS
NEW-764,HAMMAD ENGINEERING CO (PVT) LTD.,", 162-MUZAMAL TOWN OPP. WAPDA GRID 19-KM MULTAN ROAD",,37510463,,ELECTRIC TRANSFORMERS,TRANSFORMER REPAIRING
NEW-765,J.F INDUSTRIES,CHOWK DAROGHEWALA G.T. ROAD,,36545876,,ELECTRIC TRANSFORMERS,TRANSFORMER REPAIRING
NEW-766,MAQBOOL AND BROTHERS,1.5 KM CH. ROAD OFF 16 KM FEROZEPUR ROAD,,35804864,,ELECTRIC TRANSFORMERS,TRANSFORMER REPAIRING
NEW-767,PAK ELECTRON LTD.,FEROZEPUR ROAD,,5811955-6,,ELECTRIC TRANSFORMERS,TRANSFORMERS
NEW-768,TRANS FAB UMAR KHAN ROAD KOT KAMBOH MANAWAN 19 KM.,G.T. ROAD,,"6580590, 5710015-16",,ELECTRIC TRANSFORMERS,TRANSFORMERS
NEW-769,TRANS PAK ELECTRO INDUSTRIES,(PTV)LTD LINK KATAR BUND ROAD THOKAR NIAZ BAIG,,5221324-27,,ELECTRIC TRANSFORMERS,TRANSFORMERS
NEW-770,TRANS TECH SIRAJ PARK MOMINPURA,,,6545634,,ELECTRIC TRANSFORMERS,TRANSFORMERS
NEW-771,TRANSFO POWER INDUSTRIES,(PVT) LTD. 2 KM KATAR BUND ROAD THOKAR NIAZ BAIG,,"5420637, 5420653
www.transfopower.com",,ELECTRIC TRANSFORMERS,TRANSFORMERS
,SAJAWAL DIGITAL CABLE NETWORK,"SHOP # 2, MADRASSE WALI GALI, MAIN G.T ROAD, MANAWAN, LAHORE",MR. MUHAMMAD SAJAWAL - Proprietor,,sajawalmuhammad74@gmail.com,ELECTRIC CABLES,CABLE NETWORK
,LAHORE CONTROL CABLES MANUFACTURER,"5 # T, BUND ROAD, LAHORE",MR. MUHAMMAD IMRAN QURESHI - Proprietor,,lahorecables369@gmail.com,ELECTRIC CABLES,AUTO MOTIVE CONTROL CABLES
,ELAHI CABLES,"387 NARGAS BLOCK, BAHRIA TOWN, LAHORE",MR. MANZOOR ELAHI - Proprietor,,elahi.cables@gmail.com,ELECTRIC CABLES,CABLES
,DANISH INTERNATIONAL,"SHOP NO.G-1, YOUNUS CENTRE, HALL ROAD, LAHORE",MR. DANISH IJAZ - Proprietor,042-37234316 042-37213867,,ELECTRIC CABLES,CABLES
,VOLTAIC POWER AUTOMATION,"244-D, PHASE 1, PIA HOUSING SOCIETY, LAHORE",RANA ZUBAIR - Proprietor,-,-,ELECTRIC ITEMS,ELECTRIC ITEMS
,LITE PLUS,"SHOP # G-13, MAKKA CENTRE, BEADON ROAD, LAHORE",MR. QAISAR HABIB AHMED KHAN - Proprietor,"042-37324216, 042-37324215",uhad_khan1986@hotmail.com,ELECTRIC ITEMS,ELECTRIC ITEMS
,I4 JUNCTION (PVT.) LTD,"52-D COMMERCIAL AREA, 3RD FLOOR, NEW LAHORE CITY, LAHORE",MR. SALMAN FALK - Chief Executive,-,-,ELECTRIC ITEMS,DEALS IN SOLAR PANEL
,USMAN & SONS,"AL JANNAT ROAD, NAIN SUKH, SAGGIAN ROAD, LAHORE",MRS. KHADIJA USMAN - Proprietor,-,tejubutt@gmail.com,ELECTRIC ITEMS,SWITCH PLATE
,ATIF RASHEED ELECTROMECHANICAL SERVICES,"HOUSE NO.90/26-A, STREET NO.3, CHAMAN PARK, FATEH GARH MUGHALPURA, LAHORE",MR. ATIF RASHEED - Proprietor,-,-,ELECTRIC ITEMS,ELECTRICAL ITEMS
,RAMZAN INTERNATIONAL,"OFFICE # LG-21, AJWAD JAWAD CENTRE, 36- THE MALL ROAD, LAHORE",CH. ABDUL AZIZ SHAD - Proprietor,-,chazizshad@gmail.com,ELECTRIC ITEMS,ELECTRONICS ITEMS
,NEXT MAX ELECTRONICS,"25-A, 3RD FLOOR, PHASE-VI, DHA, LAHORE",MR. MUHAMMAD IMRAN - Proprietor,-,imrsuper999@gmail.com,ELECTRIC ITEMS,ELECTRONICS ITEMS
,UTK TRADING COMPANY,"64-CIRCULAR ROAD, ADDA CROWN BUS, BRANDRETH ROAD, LAHORE",MR. USMAN ALI - Proprietor,-,utktradingcompany@gmail.com,ELECTRIC ITEMS,ELECTRIC ITEMS
,MEP PAKISTAN,"OFFICE NO.3 FLOOR FAZAL APARTMENTS, FAIZ ROAD OLD MUSLIM TOWN, LAHORE",MR. SHEERAZ ALI - Proprietor,-,sheeraz709@gmail.com,ELECTRIC ITEMS,ELECTRIC EQUIPMENT
,N.B. INTERNATIONAL,"H NO.11, STREET NO.24, RAJA RAM STREET, GAWALMANDI, LAHORE",MR. MUHAMMAD NAWAZ NAEEM - Proprietor,-,nawazbutt48@gmail.com,ELECTRIC ITEMS,ELECTRIC ITEMS
,KARACHI MACHINERY STORE,"DATA PARK, OPP. ATTOCK PETROL PUMP, MAIN G.T. ROAD, SALAMAT PURA, LAHORE",MR. MAHBOOB SUBHANI - Proprietor,-,subhani_1983@hotmail.com,ELECTRIC ITEMS,POWER TOOLS
,MULTI ELECTROMECHANICAL SERVICES (PVT) LTD.,"PLOT # 50, 2-KM, KATAAR BAND ROAD, THOKAR NIAZ BAIG, LAHORE",MR. ABDULLAH - Chief Executive,042-37353011,info@mes-pk.com,ELECTRIC ITEMS,OTHER SERVICES ACTIVITIES
,SOLUTRADES,"SHOP # 2 , AZEEM MARKET, BRANDRETH ROAD, LAHORE",MR. HARIS ALI - Proprietor,042-37378536,haris.ali@solutraders.com,ELECTRIC ITEMS,ELECTRICAL PRODUCTS
,HAFIZ MOMIN INTERNATIONAL,"SHOP # 1, GROUND FLOOR, AKHLAQ CENTRE, 16- HALL ROAD, LAHORE",HAFIZ MOMIN ALI - Proprietor,-,abdulrehmanake@icloud.com,ELECTRIC ITEMS,ELECTRONICS ITEMS
,IMPERIAL LIGHTINGS,"CHATTAH COLONY, ZAIN PARK, MAIN SAGGIAN ROAD, LAHORE",MR. MUHAMMAD NOUMAN BUTT - Managing Partner,-,-,ELECTRIC ITEMS,LIGHTING PARTS
,KJF & COMPANY,"15-A, TIPU SULTAN STREET, PAKI THUTHI, AL MUMTAZ ROAD, SAMANABAD, LAHORE",MR. MUHAMMAD RIZWAN UMER - Proprietor,-,kjf.company2018@gmail.com,ELECTRIC ITEMS,ELECTRIC & SANITARY ITEMS
,AQIB ELECTRIC & ELECTRONICS,"IQBAL ROAD, SHAD BAGH, LAHORE",MR. NASIR ALI - Proprietor,-,-,ELECTRIC ITEMS,ELECTRONICS
,SHAH MOQEEM ELECTRIC CO,"LG-36, GRACE TOWER, BULL ROAD, BRANDRETH ROAD, LAHORE",MR. TARIQ ALI - Proprietor,-,smelectric@yahoo.com,ELECTRIC ITEMS,GENERAL ORDER SUPPLIER
,MEHAR ELECTRIC COMPANY,"OFFICE NO.13, 1ST FLOOR, ISMAEEL CENTER, 55- BRANDRETH ROAD, LAHORE",MR. NAVEED AHMAD - Proprietor,042-37663860,meharelectriccompany@gmail.com,ELECTRIC ITEMS,NON-SPECIALIZED WHOLESALE TRADE
,CHAMPION TRADERS,"SHOP NO.1, S-40 R-24, MEWA MANDI, FLEMING ROAD, LAHORE",MR. MUHAMMAD ALI MALIK - Proprietor,-,championtraders@yahoo.com,ELECTRIC ITEMS,ELECTRICAL/SOLAR/HARDWARE/AUTO PARTS
,STELLAR ENGINEERING SOLUTIONS,"E-466/A-1-A, NEW IQBAL PARK, WALTON CANTT- LAHORE",MR. SHAHEER AHMED BUTT - Partner,042-36621428,sa.stellar@hotmail.com,ELECTRIC ITEMS,ELECTRICAL GOODS AND MEDICAL EQUIPMENTS
,FLOWTRONICS CONTROL & AUTOMATION,"OFFICE NO.26, STREET NO.14, BABA FARID COLONY, CHUNGI AMAR SIDHU, LAHORE",MR. MUHAMMAD GHOUS - Partner,042-35236506,flowtronics.ca@gmail.com,ELECTRIC ITEMS,"FLOW METER, TRANSMITTER, CONTROL VALVE"
,ELECTRONIC SOLUTIONS,"NEAR MALMO BAKERS, MAIN WAHDAT ROAD, MULTAN CHUNGI, LAHORE",HAFIZ ALI RAZA - Proprietor,-,electronicsolutions6712@gmail.com,ELECTRIC ITEMS,ELECTRIC ITEMS
,JAVED ELECTRIC COMPANY,"OFFICE NO.1, BULL ROAD, LINK BRANDRETH ROAD LAHORE",MR. MUHAMMAD JAVED - Proprietor,042-37662961,mjavedhamza@gmail.com,ELECTRIC ITEMS,GENERAL SUPPLIES
,MECHANICAL & ELECTRICAL CONSULTANTS,"2ND FLOOR, SADIQ BUILDING, 26- PATIALA GROUND, LAHORE",MIRZA ALTAF HUSSAIN - Proprietor,-,meconsultants@hotmail.com,ELECTRIC ITEMS,ELECTRICALS/CONSULTANT
,ASAD ELECTRIC WORKSHOP,"NOORANI MASJID, ST HO NO.87/F MOH, DARS BARAY MIAN, MUGHALPURA, LAHORE",MR. ASAD MAHMOOD RAJA - Proprietor,-,rajaw2373@gmail.com,ELECTRIC ITEMS,ELECTRIC ITEMS
,BAREERA TRADERS,"SHALIMAR LINK ROAD, LAHORE",MR. MUHAMMAD IRFAN SHAMIM - Proprietor,-,irfanshamim3@gmail.com,ELECTRIC ITEMS,ELECTRIC ITEM
,PACK-N-LINK ENTERPRISES,"SHOP NO.3, YASEEN BASEMENT MARKET, BADAMI BAGH, LAHORE",MR. MOHSIN IMTIAZ ALI - Proprietor,-,-,ELECTRIC ITEMS,ELECTRICAL EQUIPMENT & MACHINES
,UNIQUE IMPORT AND EXPORT (PVT) LTD.,"OFFICE NO.3, 28 CIVIC CENTER, BARKAT MARKET, NEW GARDEN TOWN, LAHORE",MR. FARHAN MEHMOOD RANJHA - Chief Executive,-,ranjhafarhan@yahoo.com,ELECTRIC ITEMS,ELECTRICAL PRODUCTS
,FMD INTERNATIONAL TRADER (PVT) LTD,"1ST FLOOR, 28 CIVIC CENTER, BARKAT MARKET, NEW GARDEN TOWN, LAHORE",RAI ZAFAR IQBAL KHARAL - Director,-,raizafar80@gmail.com,ELECTRIC ITEMS,CONSUMER ELECTRIC PRODUCTS
,TARRA TRADERS,"SHARIF GARDEN, STREET NO.3, MAQSOODAN PURA, DAROGHAWALA, LAHORE",MR. MUHAMMAD AATIF KHAN - Managing Partner,-,info@tarratraders.com,ELECTRIC ITEMS,ELECTRICAL GOODS AND ELECTRICAL APPLIANCES
,PAK HUB IMPEX,"BISMILLAH MARKET, 16- HALL ROAD, LAHORE",HAFIZ MUHAMMAD ABDULLAH KHAN - Proprietor,-,pakhubimpex@gmail.com,ELECTRIC ITEMS,ELECTRIC GOODS
,ASIM INTERNATIONAL,"ROOM NO. 06, 2ND FLOOR,MUMTAZ CENTRE, 15-A- QUEENS ROAD, LAHORE",MR. KHURRAM JAMIL - Managing Partner,042-36375209,brother@lcci.org.pk,ELECTRIC ITEMS,ELECTRIC ITEMS
,BALAWAL HUSSAIN & BROTHERS,"REHMAN STREET NO.6, MUSLIM MARKET, 97- RAILWAY ROAD, LAHORE",SH. MUHAMMAD ABDULLAH JAVED - Proprietor,042-37228484,balawalhussain@gmail.com,ELECTRIC ITEMS,FANS
,A.Y.N.R. CORPORATION,"STREET MIAN SIKANDAR WALI MAIN BAZAR ROAD KOT, KASUR",MR. NADEEM YASEEN SHANAWAR - Proprietor,"049-2000889, 049-2010623",-,ELECTRIC ITEMS,ELECTRONIC ITEMS
,MOHSIN AND WAQAR BROTHERS,"56-MOHSIN & WAQAR PLAZA, LALA ZAR MARKET, RAIWIND ROAD, THOKER NIAZ BAIG, LAHORE",MIAN ALAM ALI - Managing Partner,"042-35963388, 042-36370175",info@mohsinwaqar.com.pk,ELECTRIC ITEMS,ELECTRIC ITEMS
,WORLD MACHINERY STORE,"NEAR ATTOCK PETROL PUMP, SALAMAT PURA STOP, G.T. ROAD, DAROGHAWALA, LAHORE",MR. MUHAMMAD SALMAN FAROOQ - Proprietor,042-36540027,iinformation.wms@gmail.com,ELECTRIC ITEMS,GENERATOR/SOLAR ENERGY
,SIPCO CORP,"75-B-II, GULBERG-III, LAHORE",MR. KASHIF JALIL - Partner,-,awamipk@gmail.com,ELECTRIC ITEMS,ELECTRIC ITEMS
,GAME COLLECTION,"SHOP NO. 19-20, BASEMENT ZAITOON PLAZA, HALL ROAD, LAHORE",MR. MUHAMMAD TAHIR - Managing Partner,042-37222022,maintahir11@hotmail.com,ELECTRIC ITEMS,Game Accessories
,EMAAN TRADE CONCERN,102-A CAVALRY GROUND SHALIMAR LANE CANTT LAHORE,MR. MUHAMMAD ASIM SALEEM - Proprietor,-,msaleemlucky@gmail.com,ELECTRIC ITEMS,Electric Goods
,ABID TRADING COMPANY,"SHOP NO. 2, 1st FLOOR, NATIONAL BARA MARKET, SHAHALAM, LAHORE",MR. TAHIR KHAN - Proprietor,042-37650097,abidtrade@yahoo.com,ELECTRIC ITEMS,ELECTRIC GOODS
,Q.W. ELECTRONICS,"OFFICE NO.1, STREET NO.4/A, MALIK GHAIS UD DIN STREET, MILLAT ROAD, LAHORE",MR. QASIM ALI - Proprietor,"042-37146426, 042-38422465",qasimqwe@gmail.com,ELECTRIC ITEMS,"AUTOMATIC VOLTAGE,STABILIZER, UPS"
,ORIZZONTE INTERNATIONAL,"20-D/12, MUHAMMADI PARK, MUMTAZ STREET, DURAND ROAD, LAHORE",MR. IRFAN ASHRAF KHAN - Proprietor,042-37668043,orizzontei@hotmail.com,ELECTRIC ITEMS,ELECTRIC ITEMS
,SUBHANI ENTERPRISES,"ROOM NO.316, 3RD FLOOR, ASHRAF PLAZA, 17- MCLEOD ROAD, LAHORE",MR. ABID ALI - Proprietor,042-37356096,samamj@yahoo.com,ELECTRIC ITEMS,ELECTRIC ITEMS
,AMFAH INTERNATIONAL,"28-AL-MECCA MOBILE CENTER GROUND FLOOR, HALL ROAD, LAHORE",MIRZA HAIDER RAZA - Proprietor,042-37365217,ggbchina2@hotmail.com,ELECTRIC ITEMS,ELECTRICAL ITEMS
,GUL GROUP OF BUSINESS,"10- FLEMING ROAD, AHATA NAWAB SHAH, LAHORE",MR. GUL MUHAMMAD MIRZA - Managing Partner,042-37634731,gulmirza@yahoo.com,ELECTRIC ITEMS,ELECTRIC ITEM
,B.T.M. ELECTRONICS,"SHOP NO.1, AL-RIAZ SHOPPING CENTRE, SHALIMAR LINK ROAD, SHALIMAR TOWN, LAHORE",MR. FARAZ AHMED - Proprietor,042-36810070,btm.electronics@hotmail.com,ELECTRIC ITEMS,ELECTRIC ITEMS
,MITECH,"66-D-3, ENGINEERS TOWN, SECTOR A, DEFENCE ROAD, LAHORE",SYED FAIZAN ABSAR - Managing Partner,042-38910732,syed@mitech.com.pk,ELECTRIC ITEMS,ELECTRIC EQUIPMENT
,ALLAH WALE ELECTRIC STORE,"SHOP NO. 17-A, MADINA ELECTRIC MARKET, SHAH ALAM MARKET, LAHORE",MR. KHURAM SHAHZAD - Proprietor,042-37651814,shneemzafar@hotmail.com,ELECTRIC ITEMS,ELECTRIC ITEMS & CABLES
,MIAN ELECTRIC STORE,"SHOP NO.10-G, AL MAKKAH CENTER, 3- BEADON ROAD LAHORE",MR. QAYYUM AHMAD - Proprietor,042-36169486,-,ELECTRIC ITEMS,ELECTRIC ITEMS
,GREEN INDUSTRIAL SOLUTIONS (PVT) LTD,"104-J, NEAR EXPO CENTER, JOHAR TOWN, LAHORE",MR. MUHAMMAD TAHIR - Managing Director,"042-35458586, 111-483-111",tahir@greenindsol.com,ELECTRIC ITEMS,HEAVY ELECTRICAL ITEMS/ INSTALLATION
,SALEEM TRADERS INDUSTRY,"37-E, SHAH ALAMGIR MARKET, SHAHALAM, LAHORE",MR. SOHAIB AHMED - Managing Partner,042-37655619,traderssaleem@yahoo.com,ELECTRIC ITEMS,ELECTRIC ITEMS
,ASBAH EMAAN ENTERPRISES,"HOUSE NO.210, BLOCK-4, KARIM PARK, RAVI ROAD, KAZIM PARK, LAHORE",MR. SALMAN NAZIR BUTT - Managing Partner,042-37215974,sulemanbuttchina@yahoo.com,ELECTRIC ITEMS,TV REMOTE PARTS
,LONGER DEVELOPMENT (PVT) LTD,"HOUSE NO.4, STREET NO.1, BLOCK-C, EDEN VALUE HOMES, MULTAN ROAD, LAHORE",MR. PAN BOLIANG - Director,-,longerpak@gmail.com,ELECTRIC ITEMS,MACHINERY & ELECTRONICS ITEMS
,SWATI CORPORATION,"16-CCA, SECTOR A, PHASE V, DHA, LAHORE",MR. MUHAMMAD SALEEM IMRAN - Proprietor,-,saleemswati@gmail.com,ELECTRIC ITEMS,ELECTRIC ITEMS
,AG TEK (PVT) LTD,"179-S, IMPERIAL GARDEN, PARAGON CITY, BARKI ROAD, LAHORE",MR. MUHAMMAD ABBAS - Director,"042-37187640, 042-37187641",ceo@agtek.com.pk,ELECTRIC ITEMS,"ELECTRIC ITEMS, POWER GENERATOR"
,HERO TRADERS,"3RD FLOOR, SONY CENTRE, KACHA HALL ROAD, LAHORE",MR. RAMZAN MAQSOOD - Proprietor,042-37232510,heroups1@gmail.com,ELECTRIC ITEMS,ELECTRONICS ITEMS
,SARTAJ ELECTRIC COMPANY,"LAHORE ELECTRIC MARKET, 14- BRANDRETH ROAD, LAHORE",MR. TOUFIQ AHMAD - Proprietor,042-37657434,sartaj.electric@yahoo.com,ELECTRIC ITEMS,ELECTRIC ITEMS
,ENNOBLE INDUSTRIAL ENGINEERING,"SHOP G-22, KHADIM CENTER, 45- THE MALL ROAD, LAHORE",MR. ARFAN ASHFAQ - Managing Partner,042-37246132,arfan@eie.com.pk,ELECTRIC ITEMS,ELECTRICAL ITEMS
,KHARAL INDUSTRY,"HOUSE NO.101, STREET NO.64, AKRAM PARK, BUND ROAD, NEAR KHOKHA STOP, SANDA KALAN, LAHORE",MR. MUHAMMAD FAROOQ AZAM - Proprietor,042-37140968,kharalindustry@yahoo.com,ELECTRIC ITEMS,ELECTRONIC & ELECTRIC WIRE CABLES
,FAYAZ BROTHER & CO.,"GODAM NO.5, NAI ABADI WARA SATTAR, OPP. AKBAR STEEL MILLS, G.T ROAD, LAHORE",MR. FAYAZ AHMED - Proprietor,-,-,ELECTRIC ITEMS,ELECTRIC ITEMS
,POPULAR SWITCHTECH (PVT) LTD,"1ST FLOOR, HABIB CENTRE, BLOCK-A, 8-KM, CANAL BANK ROAD, THOKAR NIAZ BAIG, LAHORE",MR. WAHEED SHAHZAD - Chief Executive,-,-,ELECTRIC ITEMS,ELECTRIC ITEMS
,HAJVERY LINKS,"ROOM NO.306, 3RD FLOOR, ASHRAF PLAZA, 17- MCLEOD ROAD, LAHORE",MR. MUHAMMAD SALMAN - Proprietor,042-37356096,hajverylinks@gmail.com,ELECTRIC ITEMS,ELECTRIC ITEMS
,INNOVIV PAKISTAN (PVT.) LTD,"91-L, 105 KM, KATTAR BUND ROAD, OFF MULTAN ROAD, THOKER NIAZ BAIG, LAHORE",MR. MUZAMMIL HUSSAIN - Chief Executive,-,info@innoviv.com.pk,ELECTRIC ITEMS,"ELECTRIC ITEMS, POWER GENERATOR"
