Mship No,Company Name,Address,Name,Ph (Off),Email,Business Sector(s),Business Speciality
,BEST GLOBAL ENGINEERING,"PLOT NO.77, BLOCK-V, PAKARAB HOUSING SOCIETY, 18-K.M FEROZEPUR ROAD, LAHORE",MR. SHAFQAT IQBAL - Proprietor,042-35401824,info@bestglobalengineering.com,ELECTRICAL ENGINEERING,"ELECTRICAL EQUIPMENT, VALVES, FIRE ALARM DETECTION & FIRE SAFETY"
,AGITROL SOLUTIONS (PVT). LIMITED,"FIRST FLOOR 78-C, BLOCK A-EXTENSION, AL HAFEEZ GARDEN, PHASE-V, UMAR KHAN ROAD, NEAR LMDC, MAIN CANAL ROAD, LAHORE",MR. MUHAMMAD SHAHBAZ - Chief Executive,042-35441377,info@agitrol.com,ELECTRICAL ENGINEERING,ELECTRICAL INSTRUMENTATION / GENERAL ORDER SUPPLIER
,AGI ENGINEERING SOLUTION,"558/H-3, NEAR BY EXPO CENTER GATE NO.2, JOHAR TOWN, LAHORE",MR. MUHAMMAD IMRAN ANWAR - Proprietor,042-35138777,agies8055@gmail.com,ELECTRICAL ENGINEERING,ENGINEERING
,FN GLOBAL TRADERS,"325 UMER BLOCK, ALLAMA IQBAL TOWN, LAHORE",MRS. MAMOONA JAVAID - Managing Partner,-,info@fngtraders.com,ELECTRICAL ENGINEERING,"ELECTRICAL, MECHANICAL AND ENGINEERING"
,COGNITIVE SOLUTIONS (PVT.) LTD,"16-B, IQBAL AVENUE, LAHORE",MALIK AWAIS HASSAN - Chief Executive,042-35183793,cognitivesolutions@outlook.com,ELECTRICAL ENGINEERING,ENGINEERING ITEMS
,TBENZ INTERNATIONAL,"45-A, KHAYABAN-E-IQBAL, SECTOR XX, DHA PHASE-III, LAHORE",MR. FARRUKH ALI - Proprietor,-,info@tbenzint.com,ELECTRICAL ENGINEERING,"BEARING, SHAFTS, LUBRICANTS, CAPACITOR, WIRES ETC"
