Mship No,Company Name,Address,Name,Ph (Off),Email,Business Sector(s),Business Speciality
,NEW HUMAYO NAGINA HOUSE,"HOUSE NO.302, BLOCK-D-1, GUJJAR PURA SCHEME, BAGHBANPURA, LAHORE",MR. MUHAMMAD TAHIR - Proprietor,042-37632649,newnaginahouse@gmail.com,GEMSTONE,JEWELLERY & GEMSTONE
,ABDULLAH`S DIAMOND & GEMSTONE,"HOUSE NO.256, SARDAR STREET, NEW SAMANABAD, LAHORE",MR. ABDULLAH UMAIR ATTIQUE - Proprietor,-,royal.abdullah@hotmail.com,GEMSTONE,GEMSTONE
,ITTEHAD JEWELLERS,"MAIN BAZAR NO.2, GHAZIABAD, CANTT, LAHORE",MR. SHAHID ZIKRIYA - Proprietor,042-36852451,ittehad.jewellers2000@gmail.com,GEMSTONE,GEMSTONE
,GLOBAL IMPEX INTERNATIONAL,"13- AZIZ ROAD, MISRI SHAH, LAHORE",MR. MUHAMMAD SHAHID ANEES - Proprietor,042-36302379,globalimpexint@yahoo.com,GEMSTONE,PURE GEM STONE & JEWELLERY
,SHOAIB JEWELLERS,"811-F, SUHA BAZAR, RANG MAHAL, LAHORE",MR. MUHAMMAD YOUSAF KHAN - Managing Partner,042-37669190,if_diamond_r@hotmail.com,GEMSTONE,GEMSTONE AND JEWELLERY
,OPULENT PEARLS & STONES (PVT) LTD.,"SUIT NO.546-B, SECTOR 5, D-II, GREEN TOWN, LAHORE",MR. SHAHZAD MUZAFFAR - Chief Executive,-,opulentpearlsandstones@gmail.com,GEMSTONE,METALS & STONES
,Z.U AND SON`S,"SHOP NO.3, STREET NO.12, BARKAT PURA, SHALIMAR TOWN, LAHORE",MR. MUHAMMAD USMAN - Proprietor,-,-,GEMSTONE,JEWELLERS
