Mship No,Company Name,Address,Name,Ph (Off),Email,Business Sector(s),Business Speciality
,KHAQAN ENTERPRISES (PVT) LTD.,"175-A, BLOCK-B, UET SOCIETY, NEAR NFC PH-1, LAHORE",MR. IMRAN LIAQAT - Chief Executive,,imranbaig2008@gmail.com,GREY CLOTH / FABRIC,GREY FINISHED & DYED FABRICS
,THE LIONS TEXTILE INDUSTRIES,"SUITE NO.1, GROUND FLOOR, 13-SATLUJ BLOCK, OPP. LDA PARKING PLAZA, MOON MARKET, ALLAMA IQBAL TOWN, LAHORE",HAFIZ NAVEED-UR-REHMAN VIRK - Managing Partner,042-37801122,lionstextile@gmail.com,GREY CLOTH / FABRIC,"FABRIC ,YARN, COTTON & POLYESTER"
,SARDAR MUHAMMAD & BROTHERS FABRICS,"SHOP NO.4-5, UMER BLOCK, AZAM CLOTH MARKET, LAHORE",MR. SARDAR MUHAMMAD KHAN - Managing Partner,042-37676000,,GREY CLOTH / FABRIC,FABRIC
,PACIFIC FASHIONS INC,"HOUSE NO.324,STREET NO.7, IMPERIAL GARDEN, BARKI ROAD, PARAGON CITY, LAHORE",MR. KHALID ARSHAD - Proprietor,042-37160433,pacific-fashions@hotmail.com,GREY CLOTH / FABRIC,GREY CLOTH / FABRIC
,SIDRA TRADERS,"STREET NO.7/7 MOHALA BHASSAR PURA, NIZAM PURA ROAD, KASUR",MR. MUHAMMAD WASIM ABBAS - Proprietor,,,GREY CLOTH / FABRIC,GREY CLOTH
,AEENA HOUSE INTERNATIONAL,"HOUSE NO.142, BLOCK D2, JOHAR TOWN, LAHORE",MR. NAEEM UD DIN - Proprietor,042-35211764 042-35401342,aeenaa@hotmail.com,GREY CLOTH / FABRIC,COTTON DUCTING & CLOTH
