Mship No,Company Name,Address,Name,Ph (Off),Email,Business Sector(s),Business Speciality
,SYMBLEX (PVT) LTD,"C/O HYDER BHIMJEE & CO., AMEEN BUILDING, 65- THE MALL, LAHORE",MR. MUHAMMAD ISHAQUE KHAN - Director,-_____ -_____ --___,mikhan119@hotmail.com,INDUSTRIAL RAW MATERIAL,INDUSTRIAL RAW MATERIAL
,INTERSALES NETWORK (PVT) LTD,SHARIF CHAMBERS 68 MOZANG ROAD LAHORE,MR. DAUD AHMAD - Chief Executive,042-36361401 042-36361403 --___,intersalesnetwork@gmail.com,INDUSTRIAL RAW MATERIAL,INDUSTRIAL RAW MATERIAL
,ANJUM CHEMICAL COMPANY,"G-11-12, GROUND FLOOR, NAZIR TRADE CENTRE, 139- CIRCULAR ROAD, CHOWK SHAHALAM GATE, LAHORE",MR. UMAIR EJAZ - Proprietor,042-37653298 042-37653299 --___,umair@accpolymers.com,INDUSTRIAL RAW MATERIAL,INDUSTRIAL RAW MATRIAL
,BRAND MAKERS,"35-ROYAL PARK, MCLEOD ROAD, LAHORE",MR. SHEHRYAR MOOJID - Proprietor,"042-36283499, 042-36370158",brandmakers-1@hotmail.com,PRINTING RAW MATERIAL,PRINTING INK - LAMINATED BONDS AND IMPORT HALOGRAPHIC PRINTABLE FILMS
,WADAAN INK & COATING (PVT) LTD.,"BLOCK NO.24, FLAT NO.4, P.H.A, CUP STORE, LAHORE",MR. ALI IMRAN - Chief Executive,-,wadaanpak@gmail.com,PRINTING RAW MATERIAL,PRINTING INK & COATING
,ADVANCE PRINTING SOLUTIONS,"21- DIL MUHAMMAD ROAD, LAHORE",MR. BURZAN MANZOOR - Proprietor,042-35446447,aps12011985@gmail.com,PRINTING RAW MATERIAL,"OFFSET PRINTING INKS, OPV, PRESS ROOM, CHEMICALS"
