Mship No,Company Name,Address,Name,Ph (Off),Email,Business Sector(s),Business Speciality
NEW-1256,A.F. STEEL RE-ROLLING MILLS,"LAKHODAIR ROAD, NEAR NEW SHALIMAR TOWN",,6546063,,IRON & STEEL RE-ROLLING MILLS,M.S. PRODUCTS
NEW-1257,A.H. INDUSTRIES,"MOMINPURA, ROAD, DAROGHAWALA",,6541327,,IRON & STEEL RE-ROLLING MILLS,M.S. PRODUCTS
NEW-1258,A.N. INDUSTRIES,"(PVT) LTD., 9-KM FEROZEWALA G.T. ROAD SHAHDARA",,37963771-4,,IRON & STEEL RE-ROLLING MILLS,M.S PRODUCTS
NEW-1259,ABBAS STEEL INDUSTRIES,LAKHODAIR ROAD SHALIMAR TOWN,,,,IRON & STEEL RE-ROLLING MILLS,M.S. PRODUCTS
NEW-1260,ABDUL HAMID STEEL MILLS,SULTAN MOHMOOD ROAD,,,,IRON & STEEL RE-ROLLING MILLS,M.S. PRODUCTS
NEW-1261,ABDUL JABBAR STEEL MILLS,LAKHODAIR ROAD,,,,IRON & STEEL RE-ROLLING MILLS,M.S. BAR
NEW-1262,ABID STEEL INDUSTRIES,LAKHODAIR ROAD,,,,IRON & STEEL RE-ROLLING MILLS,M.S. BAR
NEW-1263,ADIL STEEL RE-ROLLING MILLS,SOHARWARDI STREET SHALIMAR TOWN,,6548301,,IRON & STEEL RE-ROLLING MILLS,M.S. PRODUCTS
NEW-1264,AFCO STEEL INDUSTRIES,", 38-PECO ROAD, BADAMI BAGH",,37283371-73,,IRON & STEEL RE-ROLLING MILLS,M.S PRODUCTS
NEW-1265,AFZAL STEEL RE-ROLLING MILLS,KHOKHAR ROAD BADAMI BAGH,,7282923,,IRON & STEEL RE-ROLLING MILLS,M.S. PRODUCTS
NEW-1266,AGRO STEEL INDUSTRIES,BUND ROAD DAROGHAWALA,,6826651,,IRON & STEEL RE-ROLLING MILLS,M.S. PRODUCTS
NEW-1267,AHMAD SADIQ STEEL RE-ROLLING MILLS,LAKHODAIR ROAD,,,,IRON & STEEL RE-ROLLING MILLS,M.S. BAR
NEW-1268,AHMAD STEEL MILLS,BHANI ROAD,,,,IRON & STEEL RE-ROLLING MILLS,M.S. BAR
NEW-1269,AHMAD STEEL RE-ROLLING MILLS,SULTAN MEHMOOD ROAD,,6549402,,IRON & STEEL RE-ROLLING MILLS,M.S. BAR
NEW-1270,AHMED DIN STEEL RE-ROLLING MILLS,GHOREY SHAH ROAD,,,,IRON & STEEL RE-ROLLING MILLS,M.S. PRODUCTS
NEW-1271,AHMED WAQAR INDUSTRIES,"BHANI ROAD, SHADIPURA.",,NIL,,IRON & STEEL RE-ROLLING MILLS,M.S. PRODUCTS
NEW-1272,AJMAL STEEL RE-ROLLING MILLS,", SULTAN MAHMOOD ROAD, SHALAMAR TOWN",,6854211,,IRON & STEEL RE-ROLLING MILLS,M.S. PRODUCTS
NEW-1273,AKBAR STEEL MILLS,G.T.ROAD DAROGHAWALA,,6891603,,IRON & STEEL RE-ROLLING MILLS,M.S. PRODUCTS
NEW-1274,AKHTAR BROTHERS,MISRI SHAH,,,,IRON & STEEL RE-ROLLING MILLS,M.S. BAR
NEW-1275,AKHTAR STEEL RE-ROLLING MILLS,", MAHMOOD BOOTI LAKHODAIR ROAD SHAHLAIMAR TOWN",,,,IRON & STEEL RE-ROLLING MILLS,M.S. PRODUCTS
NEW-1276,AL QAMAR STEEL RE-ROLLING MILLS,G.T. ROAD DROGHAWALA,,65442966,,IRON & STEEL RE-ROLLING MILLS,M.S. PRODUCTS
NEW-1277,ALFA STEEL (PVT) LDT. SHAHEEN PARK MUGHALPURA,,,331436,,IRON & STEEL RE-ROLLING MILLS,M.S. BAR
NEW-1278,AL-FAISAL INDUSTRIES,"BUND ROAD, SHADIPURA DAROGHAWALA",,6545018,,IRON & STEEL RE-ROLLING MILLS,M.S. PRODUCTS
NEW-1279,AL-FARID CASTING SHEHLAZ COLONY  HUNDAN CHOWK,BADAMI BAGH,,NIL,,IRON & STEEL RE-ROLLING MILLS,M.S. PRODUCTS
NEW-1280,ALLAH RAKHA STEEL INDUSTRIES,LAKHODAIR ROAD SHALIMAR TOWN,,,,IRON & STEEL RE-ROLLING MILLS,M.S. PRODUCTS
NEW-1281,ALLIED METEL INDUSTRIES,25-KM HAJI KOT DRUM STOP KALA KATAI ROAD SHAHDARA,,37020388,,IRON & STEEL RE-ROLLING MILLS,DRUM ALL SORT
NEW-1282,ALLIED STEEL RE-ROLLING MILLS,LAKHODAIR ROAD,,,,IRON & STEEL RE-ROLLING MILLS,M.S. PRODUCTS
NEW-1283,ALLIED TRADERS STEEL RE-ROLLING MILLS,SULTAN MEHMOOD ROAD,,6861780,,IRON & STEEL RE-ROLLING MILLS,M.S. PRODUCTS
NEW-1284,ALTAF INDUSTRIES,MOMINPURA ROAD,,,,IRON & STEEL RE-ROLLING MILLS,M.S. PRODUCTS
NEW-1285,AMER STEEL RE-ROLLING MILLS,SULTAN MAHMOOD ROAD SHALIMAR TOWN,,335349,,IRON & STEEL RE-ROLLING MILLS,M.S. PRODUCTS
NEW-1286,AMIN STEEL INDUSTRIES,LAKHODAIR ROAD,,,,IRON & STEEL RE-ROLLING MILLS,M.S. BAR
NEW-1287,AMIR ASIM STEEL RE-LOING MILLS,"PVT., LTD., SULTAN MAHMOOD ROAD, SHALIMAR TOWN",,6546565,,IRON & STEEL RE-ROLLING MILLS,M.S. PRODUCTS
NEW-1288,AMMAR STEEL INDUSTRIES,"SULTAN MAHMOOD ROAD, SHALIMAR TOWN",,6548848,,IRON & STEEL RE-ROLLING MILLS,M.S. PRODUCTS
NEW-1289,AMMAR STEEL RE-ROLLING MILLS,MAHMOOD BOOTI BUND ROAD,,6544220,,IRON & STEEL RE-ROLLING MILLS,M.S. PRODUCTS
NEW-1290,ANWAR STEEL INDUSTRIES,LAKHODAIR ROAD,,,,IRON & STEEL RE-ROLLING MILLS,M.S. BAR
NEW-1291,ARIF STEEL RE-ROLLING MILLS,"STULTAN MAHMOOD ROAD, MEHMOOD BOOTI, SHALIMAR TOWN",,,,IRON & STEEL RE-ROLLING MILLS,M.S. PRODUCTS
NEW-1292,ARSHAD INDUSTRIES,"SULTAN MAHMOOD ROAD, SHALAMAR TOWN",,6853594,,IRON & STEEL RE-ROLLING MILLS,M.S. PRODUCTS
NEW-1293,ARSHAD STEEL ROLLING MILLS,"SHALIMAR TOWN, LAKHODAIR",,6550698,,IRON & STEEL RE-ROLLING MILLS,M.S. PRODUCTS
NEW-1294,ARYAN STEEL INDUATRIES (PVT) LTD.,RAJPUT STREET BADAMI BAGH,,7280957-8,,IRON & STEEL RE-ROLLING MILLS,M.S. PRODUCTS
NEW-1295,ASAD STEEL RE-ROLLING MILLS,"STEET NO.61-A, NEW SHAD BAGH WASANPURA, MUHAMMADI MOHALLAH",,,,IRON & STEEL RE-ROLLING MILLS,M.S. PRODUCTS
NEW-1296,ASAD STEEL RE-ROLLING MILLS,"WASANPURA, MALI PURA OPP. RAILWAY STEEL SHOP, LALPUL MUGHALPURA",,,,IRON & STEEL RE-ROLLING MILLS,M.S. PRODUCTS
NEW-1297,ASAD STEEL RE-ROLLING MILLS,", SULTAN MAHMOOD ROAD, SHAHLIMAR TOWN",,6552277,,IRON & STEEL RE-ROLLING MILLS,M.S. PRODUCTS
NEW-1298,ASHIQ STEEL RE-ROLLING MOMINPURA G.T. ROAD,,,,,IRON & STEEL RE-ROLLING MILLS,M.S. BAR
NEW-1299,ASHRAF INDUSTRIES,"SULTAN MAHMOOD ROAD, SHALIMAR TOWN",,,,IRON & STEEL RE-ROLLING MILLS,M.S. PRODUCTS
NEW-1300,ASIA STEEL FURNACE AND RE-ROLLING MILLS,PAKISTAN MINT RASHIDPURA,,6850607,,IRON & STEEL RE-ROLLING MILLS,M.S. PRODUCTS
NEW-1301,ASIF BROTHERS,STEEL RE-ROLLING MILLS RASHIDPURA,,6817198,,IRON & STEEL RE-ROLLING MILLS,M.S. BAR
NEW-1302,ASIF STEEL RE-ROLLING MILLS,LAKHODAIR ROAD,,,,IRON & STEEL RE-ROLLING MILLS,M.S. BAR
NEW-1303,ASIM & QASIM INDUSTRIES,BHANI ROAD SHADIPURA,,6545270,,IRON & STEEL RE-ROLLING MILLS,M.S. PRODUCTS
NEW-1304,ASLAM INDUSTRIES,BHANI ROAD DAROGHAWALA,,6545270,,IRON & STEEL RE-ROLLING MILLS,M.S. PRODUCTS
NEW-1305,ASLAM STEEL ROLLING MILLS,G.T. ROAD SALAMAT PURA,,6540225,,IRON & STEEL RE-ROLLING MILLS,M.S. PRODUCTS
NEW-1306,AZAD STEEL RE-ROLLING MILLS,", NOOR ROAD, BADAMI BAGH",,7287476,,IRON & STEEL RE-ROLLING MILLS,M.S. PRODUCTS
NEW-1307,AZHAR STEEL RE-ROLLING MILLS,LAKHODAIR ROAD SHALIMAR TOWN,,6860980,,IRON & STEEL RE-ROLLING MILLS,M.S. PRODUCTS
NEW-1308,BABO SHAHID STEEL RE-ROLLING MILLS,LAKHODAIR ROAD,,6861063,,IRON & STEEL RE-ROLLING MILLS,M.S. BAR
NEW-1309,BAJWA BROS STEEL RE-ROLLING MILLS,LAKHODHAIR ROAD,,6550837,,IRON & STEEL RE-ROLLING MILLS,M.S. PRODUCTS
NEW-1310,BAJWA INDUSTRIES,BHANI ROAD SHADIPURA,,6550837,,IRON & STEEL RE-ROLLING MILLS,M.S. PRODUCTS
NEW-1311,BARKAT ALI STEEL RE-ROLLING MILLS,RASHIDPURA DAROGHAWALA,,,,IRON & STEEL RE-ROLLING MILLS,M.S. PRODUCTS
NEW-1312,BARKAT STEEL RE-ROLLING MILLS,SHADI PURA BHANI ROAD DAROGHAWALA ROAD SHALIMAR TOWN.,,,,IRON & STEEL RE-ROLLING MILLS,M.S. PRODUCTS
NEW-1313,BARKAT STEEL RE-ROLLING MILLS,", BHANI ROAD, SHAHDI PURA, DAROGHAWALA,",,6545394-95,,IRON & STEEL RE-ROLLING MILLS,M.S. PRODUCTS
NEW-1314,BASHIR SONS,STEEL CASTING 29-SAHAR ROAD BAGH BANPURA,,37963838,,IRON & STEEL RE-ROLLING MILLS,CASTING
NEW-1315,BASHIR STEEL RE-ROLLING MILLS,BUND ROAD MEHMOOD BOOTI,,336913,,IRON & STEEL RE-ROLLING MILLS,M.S. PRODUCTS
NEW-1316,BATALA STEEL INDUSTRIES,LAKHODAIR ROAD,,,,IRON & STEEL RE-ROLLING MILLS,M.S. BAR
NEW-1317,BERIWALI STEEL RE-ROLLING MILLS,", LAKHODAIR ROAD, SHALIMAR TOWN,",,6814045,,IRON & STEEL RE-ROLLING MILLS,M.S. PRODUCTS
NEW-1318,BINYAMEEN NAEEM STEEL RE-ROLLING MILLS,140 NOOR ROAD BADAMI BAGH,,37606422,,IRON & STEEL RE-ROLLING MILLS,M.S PRODUCTS
NEW-1319,BISMALLAH STEEL MILLS,LAKHODAIR ROAD MAHMOOD BOOTI,,6545014,,IRON & STEEL RE-ROLLING MILLS,M.S. PRODUCTS
NEW-1320,BLACK GOLD INDUSTRY BHOGIWAL BUND ROAD,,,6814045,,IRON & STEEL RE-ROLLING MILLS,M.S. PRODUCTS
NEW-1321,BROTHERS STEEL LTD.,KOT LAKHPAT,,6304637-8,,IRON & STEEL RE-ROLLING MILLS,M.S. PRODUCTS
NEW-1322,CAPITAL STEEL MILLS,"KHOKHAR ROAD, BADAMI BAGH",,6275755,,IRON & STEEL RE-ROLLING MILLS,M.S. PRODUCTS
NEW-1323,CH. STEEL RE-ROLLING MILL (PVT) LTD.,BADAMI BAGH,,,,IRON & STEEL RE-ROLLING MILLS,GIRDERS
NEW-1324,CH. STEEL RE-ROLLING MILLS,"SOHARWARDI STREET, SHALIMAR TOWN,",,6548325,,IRON & STEEL RE-ROLLING MILLS,M.S. BAR
NEW-1325,CH.HAFEEZ STEEL RE-ROLLING MILLS,MEHRAJPURA BADAMI BAGH,,7280710,,IRON & STEEL RE-ROLLING MILLS,M.S. PRODUCTS
NEW-1326,CHANDI STEEL RE-ROLLING MILLS,LAKHODAIR ROAD,,6810757,,IRON & STEEL RE-ROLLING MILLS,M.S. BAR
NEW-1327,CHAUDHRY STEEL INDUSTRIES,"MOMINPURA, ROAD, DAROGHAWALA.",,6546927,,IRON & STEEL RE-ROLLING MILLS,M.S. PRODUCTS
NEW-1328,CHAUDHRY STEEL REROLLING MILLS,"(PVT) LTD., 79-PECO ROAD, BADAMI BAGH",,37616007,,IRON & STEEL RE-ROLLING MILLS,M.S PRODUCTS
NEW-1329,CHENAB STEEL RE-ROLLING MILLS,BUND ROAD SHADIPURA,,6545426,,IRON & STEEL RE-ROLLING MILLS,M.S. BAR
NEW-1330,CHOHAN STEEL RE-ROLLING MILLS,SULTAN MAHMOOD ROAD SHALIMAR TOWN,,"7287233-7285381
111-008-007",,IRON & STEEL RE-ROLLING MILLS,M.S. BAR
NEW-1331,CITY STEEL MILLS,(PVT) LTD BADAMI BAGH,,6817183,,IRON & STEEL RE-ROLLING MILLS,M.S. PRODUCTS
NEW-1332,CRESENT STEEL RE-ROLLING MILLS,NOOR ROAD BADAMIBAGH,,7285136,,IRON & STEEL RE-ROLLING MILLS,M.S. PRODUCTS
NEW-1333,DATA STEEL INDUSTRIES,SOHARWARDI ST.SHALIMAR TOWN,,,,IRON & STEEL RE-ROLLING MILLS,M.S. PRODUCTS
NEW-1334,EAST END EXPORTS (PVT) LTD.,114-INDUSTRIES AREA KOT LAKHPAT,,,,IRON & STEEL RE-ROLLING MILLS,M.S. PRODUCTS
NEW-1335,EASTERN STEEL RE-ROLLING MILLS,(PVT) LTD. BECO BADAMI BAGH,,7282373,,IRON & STEEL RE-ROLLING MILLS,M.S. PRODUCTS
NEW-1336,F.S.STEEL RE-ROLLING MILLS,SULTAN MAHMOOD ROAD SHALIMAR TOWN,,,,IRON & STEEL RE-ROLLING MILLS,M.S. PRODUCTS
NEW-1337,FAHAD INDUSTRIES,BHANI ROAD SHADI PURA,,0300-4174059,,IRON & STEEL RE-ROLLING MILLS,M.S. PRODUCTS
NEW-1338,FAIZ STEEL RE-ROLLING MILLS,"BUND ROAD, NEAR KAMAL KANTA MAHMOOD BOOTI ROAD",,6816322,,IRON & STEEL RE-ROLLING MILLS,M.S. PRODUCTS
NEW-1339,FARID STEEL RE-ROLLING MILLS,ABDUL SATTAR ROAD MISRISHAH,,,,IRON & STEEL RE-ROLLING MILLS,M.S. PRODUCTS
NEW-1340,FARIDIA STEEL RE-ROLLING MILLS,NEAR KOTHI HAQ NAWAZ SULTAN MAHMOOD ROAD,,6549903,,IRON & STEEL RE-ROLLING MILLS,M.S. PRODUCTS
NEW-1341,FARZAND RE-ROLLING MILLS,K.P.A.R. BAGHBANPURA,,6547643,,IRON & STEEL RE-ROLLING MILLS,M.S. PRODUCTS
NEW-1342,FAST AND EXPORTS (PVT) LTD.,114 INDUSTRIAL AREA KOT LAKHPAT,,5116001,,IRON & STEEL RE-ROLLING MILLS,M.S. PRODUCTS
NEW-1343,FAZAL STEEL RE-ROLLING MILLS,SHALIMAR TOWN,,,,IRON & STEEL RE-ROLLING MILLS,M.S. PRODUCTS
NEW-1344,FIAZ STEEL INDUSTRIES,LAKHODAIR ROAD SHALIMAR TOWN,,,,IRON & STEEL RE-ROLLING MILLS,M.S. PRODUCTS
NEW-1345,FINE STEEL INDUSTRIES,", MAHMOOD BOOTI",,,,IRON & STEEL RE-ROLLING MILLS,M.S. PRODUCTS
NEW-1346,FIVE STAR RE-ROLLING MILLS,"BHANI ROAD SHADI PURA, DAROGHAWALA",,,,IRON & STEEL RE-ROLLING MILLS,M.S. PRODUCTS
NEW-1347,FRIENDS STEEL MILLS,LTD. ABDUL QAYYUM ROAD BADAMI BAGH,,7281371-7281639,,IRON & STEEL RE-ROLLING MILLS,M.S. BAR
NEW-1348,G.A.STEEL RE-ROLLLING MILLS,NEAR RAILWAY CROSSING,,800645-801645,,IRON & STEEL RE-ROLLING MILLS,M.S. PRODUCTS
NEW-1349,G.H. TECHNICAL (STEEL RE-ROLLING  MILLS,", SULTAN MAHMOOD ROAD, SHALAMAR TOWN)",,,,IRON & STEEL RE-ROLLING MILLS,M.S. PRODUCTS
NEW-1350,GENERAL STEEL INDUSTRIES,DATA NAGAR BADAMI BAGH,,7283369,,IRON & STEEL RE-ROLLING MILLS,M.S. PRODUCTS
NEW-1351,GHARIB NAWAZ STEEL INDUSTRIES,LAKHODAIR ROAD SHALIMAR TOWN,,0300- 4439950,,IRON & STEEL RE-ROLLING MILLS,M.S. PRODUCTS
NEW-1352,GHOUSIA STEEL MILLS,BUND ROAD DAROGHAWALA,,,,IRON & STEEL RE-ROLLING MILLS,M.S. PRODUCTS
NEW-1353,GHULAM SARWAR RE-ROLLING MILLS,LAKHODAIR ROAD,,,,IRON & STEEL RE-ROLLING MILLS,M.S. PRODUCTS
NEW-1354,GOHAR STEEL RE-ROLLING MILLS,SULTAN MAHMOOD ROAD SHALIMAR TOWN,,6854111,,IRON & STEEL RE-ROLLING MILLS,M.S. PRODUCTS
NEW-1355,GOLDEN STEEL RE-ROLLING MILLS,(PVT) LTD. NOOR ROAD BADAMI BAGH,,7280892,,IRON & STEEL RE-ROLLING MILLS,GIRDERS
NEW-1356,GOREJA STEEL MILLS,(PVT) LTD. 18-K.M.MULTAN ROAD,,5510700,,IRON & STEEL RE-ROLLING MILLS,M.S. PRODUCTS
NEW-1357,GULSHAN STEEL RE-ROLLING MILLS,LAKHODAIR ROAD,,6548645,,IRON & STEEL RE-ROLLING MILLS,M.S. PRODUCTS
NEW-1358,H.R.INDUSTRIES OPP.PAKISTAN MINT G.T. ROAD SHALIMAR TOWN,,,,,IRON & STEEL RE-ROLLING MILLS,M.S. PRODUCTS
NEW-1359,HABIB STEEL RE-ROLLING MILLS,BUND ROAD MAHMOOD BOOTI,,6820844,,IRON & STEEL RE-ROLLING MILLS,M.S. PRODUCTS
NEW-1360,HAFEEZ STEEL MILLS,OPPOSITE PAKISTAN MINT SHALIMAR TOWN,,,,IRON & STEEL RE-ROLLING MILLS,M.S. PRODUCTS
NEW-1361,HAFEEZ STEEL RE-ROLLING MILLS,SULTAN MEHMOOD ROAD SHALIMAR,,6554967,,IRON & STEEL RE-ROLLING MILLS,M.S. PRODUCTS
NEW-1362,HAFIZ & COMPANY STEEL RE-ROLLING MILLS,G.T. ROAD SHAHDARA,,,,IRON & STEEL RE-ROLLING MILLS,M.S. BAR
NEW-1363,HAIDARI STEEL INDUSTRIES,OPP.PAKISTAN MINT SHALIMAR TOWN,,,,IRON & STEEL RE-ROLLING MILLS,M.S. PRODUCTS
NEW-1364,HAIDER STEEL RE-ROLLING MILS,"SALAMATPURA G.T. ROAD, DAROGHAWALA",,6542507,,IRON & STEEL RE-ROLLING MILLS,M.S. PRODUCTS
NEW-1365,HAJI ABDUL LATIF STEEL RE-ROLLING MILLS,", ASHRAF PARK NEAR ASIA FURNACE MILLS RASHEED PURA, BAGHBANPURA",,6557522,,IRON & STEEL RE-ROLLING MILLS,M.S. PRODUCTS
NEW-1366,HAJI AND CO.,"SULTAN MAHMOOD ROAD, SHALIMAR TOWN",,6548464,,IRON & STEEL RE-ROLLING MILLS,M.S. PRODUCTS
NEW-1367,HAJI ASHRAF STEEL RE-ROLLING MILLS,LAKHODAIR ROAD,,,,IRON & STEEL RE-ROLLING MILLS,M.S. BAR
NEW-1368,HAJI MUSHTAQ STEEL MILLS,AKBAR COLONY MOMINPURA,,,,IRON & STEEL RE-ROLLING MILLS,M.S. PRODUCTS
NEW-1369,HAJI NOOR STEEL MILLS,MAHMOOD BOOTI BUND ROAD,,6542261,,IRON & STEEL RE-ROLLING MILLS,M.S. PRODUCTS
NEW-1370,HAMEED STEEL RE-ROLLING MILLS,BECO ROAD,,7203371,,IRON & STEEL RE-ROLLING MILLS,M.S. PRODUCTS
NEW-1371,HAQ BROS STEEL RE-ROLLING MILLS,"LAKHODAIR ROAD, BADAMI BAGH",,7281940,,IRON & STEEL RE-ROLLING MILLS,M.S. PRODUCTS
NEW-1372,HUSSAIN INDUSTRIES,"(STEEL RE-ROLLING MILLS) IQBAL NAGAR LAKHODAIR ROAD, SHALIMAR TOWN",,6550788,,IRON & STEEL RE-ROLLING MILLS,M.S. PRODUCTS
NEW-1373,I.M. STEEL INDUSTRY HAJI ISHAQ COLD STORAGE MEHMOOD BOOTI BUND ROAD NEAR KAROL GHATTI,,,36828091,,IRON & STEEL RE-ROLLING MILLS,M.S PRODUCTS
NEW-1374,IFTIKHAR AHMAD STEEL INDUSTRIES,GHOUS PARK SINGPURA,,,,IRON & STEEL RE-ROLLING MILLS,M.S. PRODUCTS
NEW-1375,IFTIKHAR STEEL RE-ROLLING MILLS,(PVT) LTD. NEAR KAROL GHATTI BUND ROAD,,684260-61,,IRON & STEEL RE-ROLLING MILLS,GIRDERS
NEW-1376,ILYAS STEEL,MUSLIM ABAD SHALIMAR TOWN,,,,IRON & STEEL RE-ROLLING MILLS,M.S. PRODUCTS
NEW-1377,IMRAN INDUSTRIES,BAGHBANPURA,,7281283,,IRON & STEEL RE-ROLLING MILLS,M.S. PRODUCTS
NEW-1378,IMRAN STEEL RE-ROLLING MILLS,", SULTAN MEHMOOD BUND ROAD",,0300-9488878,,IRON & STEEL RE-ROLLING MILLS,M.S. BAR
NEW-1379,INAM STEEL RE-ROLLING MILLS,SHER SHAH ROAD BADAMI BAGH,,7283940,,IRON & STEEL RE-ROLLING MILLS,M.S. PRODUCTS
NEW-1380,IQBAL MAJEED STEEL RE-ROLLING MILLS,SHALIMAR TOWN,,6820054,,IRON & STEEL RE-ROLLING MILLS,M.S. PRODUCTS
NEW-1381,IQBAL STEEL RE-ROLLING MILLS,LAKHODAIR ROAD,,,,IRON & STEEL RE-ROLLING MILLS,M.S. BAR
NEW-1382,IRFAN BROTHERS,LTD. KHOKHAR ROAD BADAMI BAGH,,7280716,,IRON & STEEL RE-ROLLING MILLS,M.S. PRODUCTS
NEW-1383,ISHTIAQ STEE INDUSTRY KAROL GHATTI MEHMOOD BOOTI BUND ROAD,,,36864260-62,,IRON & STEEL RE-ROLLING MILLS,M.S PRODUCTS
NEW-1384,ISHTIAQUE STEEL RE-ROLLING MILLS,(PVT) LTD. NOOR ROAD BADAMI BAGH,,7285302,,IRON & STEEL RE-ROLLING MILLS,GIRDERS
NEW-1385,ITTEFAQ BROTHERS,(PVT) LTD. SHADARA,,6304637-8,,IRON & STEEL RE-ROLLING MILLS,M.S. PRODUCTS
NEW-1386,ITTEHAD STEEL INDUSTRIES,KOTLI PIR ABDUL REHMAN BAGHBANPURA,,,,IRON & STEEL RE-ROLLING MILLS,M.S. PRODUCTS
NEW-1387,JAHANGIR & BROTHERS,"STEEL MILLS, MOMINPURA, DAROGHAWALA",,6550449,,IRON & STEEL RE-ROLLING MILLS,M.S. BAR
NEW-1388,JAMAL STEEL RE-ROLLING MILLS,(PVT) LTD. SIDDIQIA COLONY NOOR ROAD BADAMI BAGH,,"7280964, 7284150",,IRON & STEEL RE-ROLLING MILLS,M.S. PRODUCTS
NEW-1389,JAMEEL STEEL INDUSTRIES,LAKHODAIR ROAD SHALIMAR TOWN,,,,IRON & STEEL RE-ROLLING MILLS,M.S. PRODUCTS
NEW-1390,JAMSHED STEEL RE-ROLLING MILLS,RASHEEDPURA FATEH GARH ROAD BAGHBANPURA,,6550081,,IRON & STEEL RE-ROLLING MILLS,M.S. PRODUCTS
NEW-1391,JAVAID IQBAL STEEL RE-ROLLING MILLS,", SOHARWARDI STREET SHALIMAR TOWN",,6545048,,IRON & STEEL RE-ROLLING MILLS,M.S. PRODUCTS
NEW-1392,JAVAID NAZIR BROTHERS,"(PVT) LTD., BHANI ROAD, SHADIPURA",,6861527,,IRON & STEEL RE-ROLLING MILLS,M.S. PRODUCTS
NEW-1393,JAVAID PERVAIZ RE-ROLLING STEEL MILLS,LAKHODAIR ROAD,,,,IRON & STEEL RE-ROLLING MILLS,M.S. BAR
NEW-1394,K.M.STEEL MILLS,MOMINPURA DAROGHAWALA,,,,IRON & STEEL RE-ROLLING MILLS,M.S. PRODUCTS
NEW-1395,KAMAL STEEL RE-ROLLING MILLS,BUND ROAD MAHMOOD BOOTI,,,,IRON & STEEL RE-ROLLING MILLS,M.S. PRODUCTS
NEW-1396,KAMRAN STEEL RE-ROLLING MILLS,", LAKHODAIR ROAD, SHADIPURA",,6858779,,IRON & STEEL RE-ROLLING MILLS,M.S. PRODUCTS
NEW-1397,KARAMAT BROTHERS,MOMINPURA ROAD DAROGHAWALA,,6551615,,IRON & STEEL RE-ROLLING MILLS,M.S. PRODUCTS
NEW-1398,KARWAN STEEL RE-ROLLING MILLS,SHALIMAR TOWN,,,,IRON & STEEL RE-ROLLING MILLS,M.S. BAR
NEW-1399,KASHIF STEEL MILLS,BHOGIWAL ROAD,,6814320,,IRON & STEEL RE-ROLLING MILLS,M.S. PRODUCTS
NEW-1400,KHAJIA STEEL INDUSTRIES,", BUND ROAD, KROL GHATI",,0322-4007377,,IRON & STEEL RE-ROLLING MILLS,M.S. PRODUCTS
NEW-1401,KHALID & CO. DAROGHAWALA,,,6865423,,IRON & STEEL RE-ROLLING MILLS,M.S. PRODUCTS
NEW-1402,KHALID AND BROTHERS,"STEEL RE-ROLLING MILLS, RASHEEDPURA, FATEH GARH, ROAD",,6550304,,IRON & STEEL RE-ROLLING MILLS,M.S. PRODUCTS
NEW-1403,KHALID NASEER STEEL MILLS,MAHMOOD BOOTI BUND ROAD,,,,IRON & STEEL RE-ROLLING MILLS,M.S. PRODUCTS
NEW-1404,KHALID STEEL RE-ROLLING MILLS,PIR ROAD MAHMOOD BOOTI,,,,IRON & STEEL RE-ROLLING MILLS,M.S. PRODUCTS
NEW-1405,KHALID STEEL RE-ROLLING MILLS,", LAKHODAIR ROAD, SHALIMAR TOWN",,NIL,,IRON & STEEL RE-ROLLING MILLS,M.S. PRODUCTS
NEW-1406,KHALIL STEEL MILLS,SULTAN MAHMOOD ROAD SHALIMAR TOWN,,,,IRON & STEEL RE-ROLLING MILLS,M.S. PRODUCTS
NEW-1407,KHURRAM INDUSTRIES,BHANI ROAD SHADIPURA,,6545940,,IRON & STEEL RE-ROLLING MILLS,M.S. PRODUCTS
NEW-1408,L.R.B. STEEL RE-ROLLING MILLS,", MOMINPURA, ROAD, DAROGHAWALA,",,6551619,,IRON & STEEL RE-ROLLING MILLS,M.S. PRODUCTS
NEW-1409,LIAQAT STEEL RE-ROLLING MILL,"LAKHODAIR ROAD, SHALIMAR TOWN",,NIL,,IRON & STEEL RE-ROLLING MILLS,M.S. PRODUCTS
NEW-1410,LION STEEL INDUSTRIES,(PVT) LTD. NOOR ROAD BADAMI BAGH,,7280893-7284551,,IRON & STEEL RE-ROLLING MILLS,M.S. PRODUCTS
NEW-1411,LUCKY STEEL FOUNDRY WORKS (PVT) LTD,", MEHMOOD BOOTI BUND ROAD",,6855831-4,,IRON & STEEL RE-ROLLING MILLS,M.S. PRODUCTS
NEW-1412,M. YAQUB & BROTHERS,STEEL MILLS BUND ROAD,,7282809,,IRON & STEEL RE-ROLLING MILLS,M.S. PRODUCTS
NEW-1413,M.ISMAIL AND SONS,(PVT) LTD. ABDUL QAYYUM ROAD BADAMI BAGH,,,,IRON & STEEL RE-ROLLING MILLS,M.S. PRODUCTS
NEW-1414,M.M. STEEL MILLS,", MOMINPURA ROAD, ITTEFAQ PARK",,0300-8432129,,IRON & STEEL RE-ROLLING MILLS,M.S. PRODUCTS
NEW-1415,MADINA STEEL INDUSTRIES,NOOR ROAD SHAHBAZ COLONY BADAMI BAGH,,7609180,,IRON & STEEL RE-ROLLING MILLS,M.S. PRODUCTS
NEW-1416,MADINA STEEL INDUSTRY BUND ROAD,SHADIPURA,,6545413-50,,IRON & STEEL RE-ROLLING MILLS,M.S. BAR
NEW-1417,MADNI STEEL RE-ROLLING MILLS,MAHMOOD BOOTI,,,,IRON & STEEL RE-ROLLING MILLS,M.S. PRODUCTS
NEW-1418,MAHBOOB STEEL RE-ROLLING MILLS,BADAR STREET MISRI SHAH,,7285184,,IRON & STEEL RE-ROLLING MILLS,M.S. PRODUCTS
NEW-1419,MAJEED BROTHER STEEL RE-ROLLING MILLS,"RASHEED PURA, NEAR ASIA STEEL MILLS, BAGHBANPURA.",,6851795,,IRON & STEEL RE-ROLLING MILLS,M.S. PRODUCTS
NEW-1420,MALIK & CO. STEEL RE-ROLLING MILLS,"ABDUL SATTAR ROAD, MISRI SHAH",,7281242,,IRON & STEEL RE-ROLLING MILLS,M.S. PRODUCTS
NEW-1421,MALIK AND CO. KACHA RAHIM ROAD BADAMI BAGH,,,281243,,IRON & STEEL RE-ROLLING MILLS,M.S. PRODUCTS
NEW-1422,MALIK IMDAD INDUSTRIES,BUND ROAD SHADIPURA,,,,IRON & STEEL RE-ROLLING MILLS,M.S. PRODUCTS
NEW-1423,MALIK RIFAQAT INDUSTRIES,BHANI ROAD SHADIPURA,,,,IRON & STEEL RE-ROLLING MILLS,M.S. PRODUCTS
NEW-1424,MALIK SADIQ STEEL RE-ROLLING MILLS,LAKHODAIR ROAD,,,,IRON & STEEL RE-ROLLING MILLS,M.S. BAR
NEW-1425,MALIK STEEL RE-ROLLING MILLS,", 15KM G.T. ROAD, DAROGHAWALA",,6555721-22,,IRON & STEEL RE-ROLLING MILLS,M.S. PRODUCTS
NEW-1426,MAQBOOL STEEL RE-ROLLING MILLS,(PVT) LTD. FAROOQABAD BUND ROAD DAROGHAWALA,,,,IRON & STEEL RE-ROLLING MILLS,M.S. PRODUCTS
NEW-1427,MAQSOOD STEEL INDUSTRIES,BHANI ROAD SHADIPURA,,6558498,,IRON & STEEL RE-ROLLING MILLS,M.S. PRODUCTS
NEW-1428,MAQSOOD STEEL RE-ROLLING MILLS,MOMINPURA ROAD DAROGHAWALA,,,,IRON & STEEL RE-ROLLING MILLS,M.S. PRODUCTS
NEW-1429,MASTER STEEL NOOR ROAD BADAMIBAGH,,,,,IRON & STEEL RE-ROLLING MILLS,M.S. PRODUCTS
NEW-1430,MASTER STEEL RE-ROLLING MILLS,NOOR ROAD BADAMIBAGH,,,,IRON & STEEL RE-ROLLING MILLS,M.S. PRODUCTS
NEW-1431,MAZHAR STEEL MILLS,BHANI ROAD SHADIPURA,,,,IRON & STEEL RE-ROLLING MILLS,M.S. PRODUCTS
NEW-1432,MEHMOOD & CO. (R.S. STEEL RE-ROLLING ) KHOKHAR ROAD BADAMI BAGH,,,7282035,,IRON & STEEL RE-ROLLING MILLS,M.S. PRODUCTS
NEW-1433,MEHMOOD AHMAD STEEL RE-ROLLING MILLS,LAKHODAIR ROAD,,6550842,,IRON & STEEL RE-ROLLING MILLS,M.S. PRODUCTS
NEW-1434,MEHMOOD STEEL INDUSTRIES,", MEHMOOD BOTTI, NEAR ISHTIAQ KANTA, KAROL GHATTI, BUND ROAD",,36863231,,IRON & STEEL RE-ROLLING MILLS,M.S PRODUCTS
NEW-1435,MIAN STEEL RASHIDPURA BEHIND PAKISTAN MINT,,,6815038,,IRON & STEEL RE-ROLLING MILLS,M.S. PRODUCTS
NEW-1436,MILLAT STEEL RE-ROLLING MILLS,KHOKHAR ROAD BADAMI BAGH,,7281377,,IRON & STEEL RE-ROLLING MILLS,M.S. PRODUCTS
NEW-1437,MIRAN STEEL ROLLING SULTAN MAHMOOD ROAD,SHALIMAR TOWN,,6851228,,IRON & STEEL RE-ROLLING MILLS,M.S. PRODUCTS
NEW-1438,MITTO BROS STEEL RE-ROLLING MILLS,PIR ROAD MAHMOOD BOOTI BUND ROAD,,6545013,,IRON & STEEL RE-ROLLING MILLS,M.S. PRODUCTS
NEW-1439,MODEL STEEL ENTERPRISES,(PVT) LTD. 19-K.M.WAGHA G.T.ROAD,,6545473,,IRON & STEEL RE-ROLLING MILLS,M.S. PRODUCTS
NEW-1440,MOHAMMAD RAFIQ STEEL MILLS,AKBAR COLONY MOMINPURA ROAD,,,,IRON & STEEL RE-ROLLING MILLS,M.S. PRODUCTS
NEW-1441,MOHAMMADI STEEL RE-ROLLING MILLS,BHANNI ROAD SHADIPURA,,,,IRON & STEEL RE-ROLLING MILLS,M.S. PRODUCTS
NEW-1442,MS INDUSTRIES,"BUND ROAD, SHADIPURA",,6542463,,IRON & STEEL RE-ROLLING MILLS,M.S. PRODUCTS
NEW-1443,MUGHAL SHAHEEN STEEL RE-ROLLING MILLS,"BUND ROAD, MAHMOOD BOOTI",,6849893,,IRON & STEEL RE-ROLLING MILLS,M.S. PRODUCTS
NEW-1444,MUGHAL SONS,(PVT) LTD. NOOR ROAD BADAMI BAGH,,"111-000-007
7610768",,IRON & STEEL RE-ROLLING MILLS,M.S. PRODUCTS
NEW-1445,MUGHAL SONS,"(PVT) LTD., RE-ROLLING MILLS NOOR ROAD, BADAMI BAGH",,7610160,,IRON & STEEL RE-ROLLING MILLS,M.S. PRODUCTS
NEW-1446,MUHAMMAD HANIF STEEL INDUSTRIES,LAKHODAIR ROAD SHALIMAR TOWN,,,,IRON & STEEL RE-ROLLING MILLS,M.S. PRODUCTS
NEW-1447,MUHAMMAD LIAQAT STEEL RE-ROLLING MILLS,"MOMINPURA, ROAD, DAROGHAWALA,",,6860572,,IRON & STEEL RE-ROLLING MILLS,M.S. PRODUCTS
NEW-1448,MUHAMMAD SADDIQUE BROTHERS,PECO ROAD BADAMIBAGH,,7281513,,IRON & STEEL RE-ROLLING MILLS,M.S. PRODUCTS
NEW-1449,MUHAMMAD SAEED RE-ROLLING MILLS,LAKHODAIR ROAD SHALIMAR TOWN,,,,IRON & STEEL RE-ROLLING MILLS,M.S. PRODUCTS
NEW-1450,MUHAMMAD SIDDIQUE STEEL RE-ROLLING MILLS,", LAKHODAIR ROAD SHALIMAR TOWN",,6545018,,IRON & STEEL RE-ROLLING MILLS,M.S. PRODUCTS
NEW-1451,MUHAMMAD STEEL RE-ROLLING MILLS,SHADIPURA DAROGHAWALA,,6545406,,IRON & STEEL RE-ROLLING MILLS,M.S. PRODUCTS
NEW-1452,MUHAMMAD YAQOOB STEEL INDUSTRIES,LAKHODAIR,,,,IRON & STEEL RE-ROLLING MILLS,M.S. PRODUCTS
NEW-1453,MUHAMMAD YOUNIS STEEL RE-ROLLING MILLS,LAKHODAIR ROAD,,6861642,,IRON & STEEL RE-ROLLING MILLS,M.S. BAR
NEW-1454,MUMTAZ STEEL  RE-ROLLING MILLS,LAKHODAIR ROAD,,6551477,,IRON & STEEL RE-ROLLING MILLS,M.S. BAR
NEW-1455,MUNIR STEEL RE-ROLLING SOHARWARDI ST.SHALIMAR TOWN,,,6865306,,IRON & STEEL RE-ROLLING MILLS,M.S. PRODUCTS
NEW-1456,MURTAZA STEEL RE-ROLLING MILLS,", (PVT) LTD. MOMINPURA, ROAD, DARYA WALA LAHORE",,6552161,,IRON & STEEL RE-ROLLING MILLS,M.S. PRODUCTS
NEW-1457,MUSHTAQ ALI STEEL RE-ROLLING MILLS,KOTLI PIR ABDUR REHMAN BAGHBANPURA,,6850458,,IRON & STEEL RE-ROLLING MILLS,M.S. PRODUCTS
NEW-1458,MUSHTAQ STEEL RE-ROLLING MILLS,MOMINPURA DAROGHAWALA ROAD,,,,IRON & STEEL RE-ROLLING MILLS,M.S. PRODUCTS
NEW-1459,MUSTAFA STEEL RE-ROLLING MAHMOOD BOOTI PIR ROAD,,,,,IRON & STEEL RE-ROLLING MILLS,M.S. BAR
NEW-1460,NAEEM ASHRAF STEEL RE-ROLLING MILLS,BHANI ROAD SHADIPURA,,6541485,,IRON & STEEL RE-ROLLING MILLS,M.S. PRODUCTS
NEW-1461,NAEEM BROS STEEL RE-ROLLING MILLS,", NOOR ROD, BADAMI BAGH",,7280299,,IRON & STEEL RE-ROLLING MILLS,M.S. PRODUCTS
NEW-1462,NAEEM SONS,"STEEL & GENERAL MILLS 21 KM., G.T. ROAD",,6582266,,IRON & STEEL RE-ROLLING MILLS,M.S. PRODUCTS
NEW-1463,NAVEED FAHIM STEEL RE-ROLLING MILLS,MAHMOOD BOOTI BUND ROAD,,6827619,,IRON & STEEL RE-ROLLING MILLS,M.S. PRODUCTS
NEW-1464,NAZIR AHMAD STEEL RE-ROLLING MILLS,"LAKHODAIR ROAD, MOHALLAH IQBAL NAGAR SHALAMAR TOWN",,6550757,,IRON & STEEL RE-ROLLING MILLS,M.S. PRODUCTS
NEW-1465,NAZIR SONS,"STEEL RE-ROLLING MILLS (PVT) LTD., 345 G.T. ROAD DAROGHAWALA",,6546141,,IRON & STEEL RE-ROLLING MILLS,M.S. PRODUCTS
NEW-1466,NEMAT ULLAH STEEL MILLS,MAHMOOD BOOTI BUND ROAD,,6543204,,IRON & STEEL RE-ROLLING MILLS,M.S. PRODUCTS
NEW-1467,NEW GHAUSIA STEEL RE-ROLLING MILL MAQSOODAN PURA,"MOMINPURA, DAROGHAWALA.",,6558721,,IRON & STEEL RE-ROLLING MILLS,M.S. PRODUCTS
NEW-1468,NEW MADINA STEEL RE-ROLLING MILLS,RASHIDPURA,,6533039,,IRON & STEEL RE-ROLLING MILLS,M.S. PRODUCTS
NEW-1469,NEW SHALIMAR STEEL RE-ROLLING INDUSTRIES,SHALIMAR TOWN,,"7722599, 6545421",,IRON & STEEL RE-ROLLING MILLS,M.S. PRODUCTS
NEW-1470,NIAMAT STEEL RE-ROLLING MILLS,MOMINPURA DAROGHAWALA,,6891397,,IRON & STEEL RE-ROLLING MILLS,M.S. PRODUCTS
NEW-1471,NICE STEEL RE-ROLLING MILLS,SULTAN MAHMOOD ROAD SHALIMAR TOWN,,333395,,IRON & STEEL RE-ROLLING MILLS,M.S. PRODUCTS
NEW-1472,NOOR STEEL MILLS,RE-ROLLING MOMINPURA ROAD DAROGHAWALA,,6546201,,IRON & STEEL RE-ROLLING MILLS,M.S. BAR
NEW-1473,ORIENT TECHNICAL (PVT) LTD,145-MULTAN ROAD,,,,IRON & STEEL RE-ROLLING MILLS,M.S. PRODUCTS
NEW-1474,PROGRESSIVE STEEL INDUSTRIES,(PVT) LTD. KALA KHATAI ROAD SHAHDARA,,"7922557, 7922554",,IRON & STEEL RE-ROLLING MILLS,M.S. BAR
NEW-1475,QADRI BROTHERS,(PVT) LTD OUTSIDE KASHMIRI GATE PECO ROAD BADAMIBAGH,,,,IRON & STEEL RE-ROLLING MILLS,M.S. PRODUCTS
NEW-1476,QUALITY STEEL MILLS,SHADIPURA BUND ROAD,,6542616,,IRON & STEEL RE-ROLLING MILLS,M.S. PRODUCTS
NEW-1477,R.R.STEEL RE-ROLLING MILLS,BADAMIBAGH NOOR ROAD,,,,IRON & STEEL RE-ROLLING MILLS,ANGLE IRON
NEW-1478,RABBANI STEEL RE-ROLLING MILLS,GHORE SHAH ROAD SINGPURA,,,,IRON & STEEL RE-ROLLING MILLS,M.S. PRODUCTS
