Mship No,Company Name,Address,Name,Ph (Off),Email,Business Sector(s),Business Speciality
NEW-2487,ELMEC ENGINEERING WORKS 41-N/A GULBERG-II,,,5756175,,SEWING MACHINES / PARTS,SEWING MACHINE PARTS
NEW-2488,PILOT ENGINEERING CO. 48-N GULBERG-II,,,,,SEWING MACHINES / PARTS,SEWING MACHINE HANDLE
NEW-2489,SALIKA SEWING MACHINE CO. (PVT) LTD.,17/C DURAND ROAD GARHI SHAHU,,"6305960, 6304297",,SEWING MACHINES / PARTS,SEWING MACHINE BODIES
NEW-2490,SANDWELL FOUNDRY WORKS. 41-N/B,GULBERG-II,,,,SEWING MACHINES / PARTS,SEWING MACHINE HANDLE
NEW-2491,SHAFIQ INDUSTRIES,43-N GULBERG-II,,5760043,,SEWING MACHINES / PARTS,SEWING MACHINE BODIES
NEW-2492,ZAHID & CO. DAROGHAWALA G.T. ROAD,,,,,SEWING MACHINES / PARTS,SEWING MACHINES
,SUBHANALLAH TRADING COMPANY,"208-DD, PHASE IV, BLOCK-DD, DHA, LAHORE",MR. USMAN RAFI - Partner,-,subhanallahgrp@yahoo.com,GENERAL MACHINERY PARTS,MACHINERY & TOOLS
,M.Z.CHAUDHRY & SONS,"88-RACHNA BLOCK, ALLAMA IQBAL TOWN, LAHORE",CH. ALI SHAHBAZ - Proprietor,042-37124688,ali@mzpp.pk,GENERAL MACHINERY PARTS,MACHINERY PARTS
,SOURCING XPERT,"OPPOSITE POLICE STATION MUSTAFABAD, 238- ALLAMA IQBAL ROAD, (DHARAMPURA), LAHORE",MR. MUHAMMAD ABDULLAH ANWAR - Proprietor,042-37190216,attif.anwer@yahoo.com,GENERAL MACHINERY PARTS,MACHINERY PARTS
,ZAR ENTERPRISES,"OFFICE # 03, FIRST FLOOR, TARIQ CENTER, ZARRAR SHAHEED RAOD, GULDASHT TOWN, LAHORE",MR. ABDUL RAUF WAHEED - Proprietor,042-36632240,raufwdbg@gmail.com,GENERAL MACHINERY PARTS,GENERAL MACHINERY PARTS & AUTO PARTS
,WE MOVERS,"OFFICE NO.38, 2ND FLOOR, MAKKAH MOBILE CENTER, MAIN HALL ROAD, LAHORE",MR. MUHAMMAM SHOAIB ASGHAR - Proprietor,-,shoaibtanoli711@gmail.com,GENERAL MACHINERY PARTS,MACHINERY & PARTS AND ELECTRIC COMPONENTS
,MRM WORLD WIDE,"93-SULTAN TOWN, RAIWIND ROAD, LAHORE",MR. RIZWAN INAYAT AKHTAR - Proprietor,-,malikshakeel0788@gmail.com,GENERAL MACHINERY PARTS,MACHINERY
,S. SIDDIQUE MILL STORE,"SHOP # G-6, LAHORE TRADE CENTER, GROUND FLOOR, BRANDRETH ROAD, LAHORE",SH. SHAHZAD SIDDIQUE - Proprietor,"042-37636066, 042-37378584",ssmillstore786@gmail.com,GENERAL MACHINERY PARTS,TEXTILE/V-BELTS
,ALPHA TOOLS,"SHOP NO.10-12, ST NO.01, MACHINERY STORE, SHARIF GARDEN, G.T ROAD, SALAMAT PURA, LAHORE",MR. AASIM NISAR - Partner,042-36546246,asimspacian@gmail.com,GENERAL MACHINERY PARTS,"CUTTING, INSERTS, TOOLS"
,METAL ARTS,"24-E, PIA HOUSING SCHEME, LAHORE",MR. MUHAMMAD RIZWAN TAHIR - Proprietor,-,rizijutt10@gmail.com,GENERAL MACHINERY PARTS,GENERAL MACHINERY AND PARTS
,AZAAN & CO,"S-3, OPPOSITE HABIB BANK LTD, 28- BRANDRETH ROAD, LAHORE",MR. JUNAIDULLAH AHMAD - Proprietor,"042-37674194, 042-37674195",azaanco@gmail.com,GENERAL MACHINERY PARTS,"INSTUMENT PRESSURE, TEMPERATURE LEVEL"
,TEX PLUS TRADING,"14, GG, PHASE-IV, DHA, LAHORE",MR. HAMMAD AKBAR KHAN - Managing Partner,042-37186357,info@texplustrading.com,GENERAL MACHINERY PARTS,"EXPANSION JOINTS, BEARING PADS USED IN BRIDGES"
,GLOBAL COMMUNICATION SYSTEMS (PVT) LTD,"19 - A, 3 - JINNAH PARK GULBERG-II, LAHORE",MR. MUHAMMAD IRFAN - Chief Executive,"042-35759711, 042-35759683",gcsho@yahoo.com,GENERAL MACHINERY PARTS,ALL KIND OF MACHINERY AND EQUIPMENTS
,BUHLER PAKISTAN (PVT) LTD.,"PLOT # 90 M/2, QUAID-E-AZAM INDUSTRIAL ESTATE, KOT LAKHPAT, LAHORE",MR. UGUR TOLGA CELTEKLIGIL - Chief Executive,"042-32708000, 042-32708003",imran.anjum@buhlergroup.com,GENERAL MACHINERY PARTS,FOOD SUPPLIES MACHINERY & PARTS
,GLOBAL VISION TRADING (PVT.) LTD.,"236 CCA-4, T BLOCK, OFFICE NO.2, 4TH FLOOR, PHASE-7 DHA, LAHORE",MR. SAJJAD MAHMOOD - Director,-,globalvisionpvt7@gmail.com,GENERAL MACHINERY PARTS,"MECHANICAL, INDUSTRIAL, ELECTRIC & ELECTRONIC SPARE PARTS"
,WORLD INTERNATIONAL TRADING CO,"PLOT # 112, 3RD FLOOR, TIMBER MARKET, RAVI ROAD, LAHORE",MR. MUHAMMAD ARSLAN - Proprietor,042-37701718,adnanrox90@gmail.com,USED MACHINERY AND PARTS,USED MACHINERY
,AL MAA PRODUCTS,"693 LATIF STREET, PATHI GROUND, DIL MUHAMMAD ROAD, LAHORE",MR. HAMID JAVAID - Proprietor,-,-,USED MACHINERY AND PARTS,USED MACHINERY
,EXPERT GLOBAL SOURCING (PVT.) LTD,"HOUSE # 77, ST # 13, CAVALRY GROUND, CANTT- LAHORE",MR. IRFAN ZAHID - Chief Executive,-,irfan_smile@hotmail.com,USED MACHINERY AND PARTS,MACHINERY PARTS
,AFZAL TRADER,"DATA PARK SALAMAT PURA OPP. ATTOCK PETROL PUMP MAIN G.T. ROAD, DAROGHAWALA, LAHORE",MR. MUHAMMAD AFZAL - Proprietor,042-36544200,afzal.trader21@gmail.com,USED MACHINERY AND PARTS,USED MACHINERY
,BILAL INTERNATIONAL & CO.,"SOYA WALA ROAD, SHARIF GARDEN, SALAMAT PURA, NEAR DAROGHAWALA, LAHORE",MR. MUHAMMAD TANVEER - Proprietor,-,bilalinternational111@gmail.com,USED MACHINERY AND PARTS,OLD MACHINERY PARTS
,KOH-E-NOOR TRADERS,"OPPOSITE SADIQ KHAN SCHOOL, TAJPURA ROAD, CANTT, LAHORE",MR. MUHAMMAD USMAN - Managing Partner,-,-,USED MACHINERY AND PARTS,ELECTRICAL APPLIANCE & SECURITY TOOLS
,NADEEM & SONS TRADING COMPANY,"SHAREEF GARDEN MACHINERY MARKET OPPOSITE ATTOCK PUMP, DAROGHAWALA, LAHORE",MR. SAIF ULLAH - Proprietor,-,saifullahnadeem1@gmail.com,USED MACHINERY AND PARTS,USED & NEW MACHINERY
,AFTAB INTERNATIONAL,"OFFICE NO.F/2347, CHUNA MANDI, RARA TALIYAN, AZAM CLOTH MARKET, LAHORE",SYED AFTAB HUSSAIN SHAH - Proprietor,-,-,USED MACHINERY AND PARTS,CONSTRUCTION MACHINERY
,A-Z CORPORATION,"SHOP # 4, 25 BABAR STREETCHOWK DALGIRA 50 BRANDRETH ROAD, LAHORE",MR. NOUMAN AHMAD - Proprietor,042-3736726,a-zcorportion@hotmail.com,USED MACHINERY AND PARTS,MACHINERY PARTS
,WAQAS HUSSAIN ENTERPRISES,"HOUSE NO.8, STREET NO.5, MUHAMMADI STREET, NOUNARIAN CHOWK, LAHORE",MR. WAQAS HUSSAIN - Proprietor,-,waqashussainenterprises@gmail.com,USED MACHINERY AND PARTS,USED MACHINERY SCRAPE
,UNIVERSAL ENERGY SYSTEMS,"MAIN G.T ROAD, MOMINPURA, LAHORE",MR. MUHAMMAD MUJTABA NAZEER - Proprietor,042-36544786,mujtaba-nazeer@yahoo.com,USED MACHINERY AND PARTS,USED MACHINERY
,AYAZ MACHINERY,"PLOT # 29, STREET # 01, SHARIF GARDEN MACHINERY MARKET, OPPOSITE ATTOCK PETROL PUMP, SALAMAT PURA, LAHORE",MR. MUHAMMAD AYAZ - Proprietor,-,ayazk2895@gmail.com,USED MACHINERY AND PARTS,MACHINERY
,ABEE GRAPHICS (PVT) LTD.,"WATER LAND STREET, NEAR SAGGIAN BRIDGE, NAIN SUKH, LAHORE",MR. MUHAMMAD AYOUB - Chief Executive,042-37339618,muhammadayoubabee9@gmail.com,USED MACHINERY AND PARTS,USED MACHINERY
,AQIB ENTERPRISES,"NEAR MASJID FAIZ-E-MUSTAFA KARIM PURA, S PURA, LAHORE",MR. AQIB ALI KHAN - Managing Partner,-,aqibenterprises6@gmail.com,USED MACHINERY AND PARTS,USED MACHINERY AND ELECTRICAL SCRAP
,SHIRAZ ENTERPRISES,"LDA-304, MOHALA JANI PURA, BAGHBANPURA, LAHORE",MR. SHIRAZ AHMAD - Proprietor,-,shiraz.enterprises.operations@gmail.com,USED MACHINERY AND PARTS,CONSTRUCTION MACHINERY
,M KAMAL & SONS,"E-153, D-1, GHAZNI LANE, NEW SUPER TOWN, LAHORE",MR. AZIZ ULLAH - Proprietor,-,m.kamal.sons.services@gmail.com,USED MACHINERY AND PARTS,TEXTILE MACHINERY
,GENERAL TRADING COMPANY,"QADRI GODAM, 128/5 KACHA RAHIM ROAD, MISRI SHAH, LAHORE",MR. NAVEED IQBAL - Proprietor,-,-,USED MACHINERY AND PARTS,USED MACHINERY AND PARTS
,MACHINE YARD,"333-A G.T.ROAD, DAROGHAWALA, LAHORE",SYED WAQAS ABID GILLANI - Managing Partner,-,info@machineyard.tk,USED MACHINERY AND PARTS,USED MACHINERY
,GLOBAL BUSINESS TRADING CO,"PLOT NO.1 SHARIF GARDEN, GT ROAD, DAROGHAWALLA, LAHORE",MR. MOHAMMAD SULTAN TIPU - Proprietor,042-36546919,tipoo555@hotmail.com,USED MACHINERY AND PARTS,USED MACHINES
,M.D. ENTERPRISES,32-E EMPRESS ROAD LAHORE,MR. MUHAMMAD DANISH SOLERI - Proprietor,042-36367749,taxsahulat@live.com,USED MACHINERY AND PARTS,NEW MACHINERY & USED MACHINERY
,NAVEED ENGINEERING,"80-A, SHARIF GARDEN, G.T ROAD , SALAMAT PURA, LAHORE",MR. NAVEED AHMAD - Proprietor,"042-36531633, 042-36531634",naveed_engineering@yahoo.com,USED MACHINERY AND PARTS,USED MACHINERY
,SHAFIQUE TRADERS,"OFFICE # 6-7, 2ND FLOOR, AL-NOOR CENTRE, 63- CIRCULAR ROAD, LAHORE",MR. SHAFIQ AHMAD - Proprietor,042-37659730,reyanch15@yahoo.com,USED MACHINERY AND PARTS,USED MACHINERY AND PARTS
,YAWAR ENTERPRISES,"INSIDE AIK MORIA PUL, MUSLIM STREET # 1, NEAR HABIB BANK, RAHIM ROAD, MISRI SHAH, LAHORE",MR. SALAHUDDIN - Proprietor,042-37607315,yawarenterprises57@gmail.com,USED MACHINERY AND PARTS,USED MACHINERY AND PARTS
,SIGMEN PAKISTAN,"20,23, 1ST FLOOR, FARID PLAZA, 65- SHADMAN, LAHORE",RAO MUHAMMAD FAISAL IQBAL - Proprietor,042-37424451,sigmenpakistan@yahoo.com,USED MACHINERY AND PARTS,MACHINERY PARTS
,S.A.A. TRADE MASTER,"OFFICE NO.24, 2ND FLOOR, AL-LATIF CENTER, 88/D-1 MAIN BOULEVARD, GULBERG-III, LAHORE",MR. MUHAMMAD AFZAL - Managing Partner,042-35781278,info@saatrademaster.com,USED MACHINERY AND PARTS,USED AND NEW MACHINERY
,IHTISHAM TRADERS,"HOUSE NO.22-A, STREET NO.8 QADRIA STREET, NISHTER TOWN, DAROGHAWALA, LAHORE",MR. IHTISHAM SHAFIQUE - Proprietor,-,ihti_sham@hotmail.com,USED MACHINERY AND PARTS,USED MACHINERY
,SMART CLIMATE SOLUTIONS (PVT.) LTD.,"54 FCC, ZAHOOR ELAHI ROAD, GULBERG-IV, LAHORE",MR. AHSAN ASLAM - Director,"042-35763171, 042-35763174",accounts@climatesolutions.com.pk,USED MACHINERY AND PARTS,USED MACHINERY & PARTS
,NOOR TRADING,"OFFICE NO.11, 2ND FLOUR D 38-DAVIS ROAD, DATA GUNJ BAKSH TOWN, LAHORE",MR. SHABBIR AHMAD - Partner,-,-,USED MACHINERY AND PARTS,IMPRT MACHINERY & PARTSA
,CAD CAM SOLUTIONS,"26-B, GUL-E-DAMAN SOCIETY, COLLEGE ROAD, LAHORE",MR. MUHAMMAD SHAHZEB KHAN - Proprietor,-,cadcam.solutions26@gmail.com,USED MACHINERY AND PARTS,USED MACHINERY
,AIM TRADING,"PLOT NO.4, RAJBAH ROAD NEAR KARIM NAGAR, WARA STOP, LAHORE",MR. MAZHAR SIDDIQUE - Partner,-,aimtrading1537@gmail.com,USED MACHINERY AND PARTS,MACHINERY & EQUIPMENT
,MIB INDUSTRIAL CO.,"9-10, 25-BABAR STREET, DALGERAN CHOWK, BRANDRETH ROAD, LAHORE",MR. SUHAIL IQBAL BUTT - Proprietor,"042-37241026, 042-37242712",mibico@yahoo.com,USED MACHINERY AND PARTS,USED MACHINERY AND PARTS
,AL-QAMAR MACHINERY,"SHOP 25-15-17, NEAR CHOWK DALGRAN, DIL MUHAMMAD ROAD, LAHORE",MR. ADNAN MUZAFFAR - Proprietor,"042-37234419, 042-37220919",mhadnan@hotmail.com,USED MACHINERY AND PARTS,USED MACHINERY
,I.S TEXTILE,"10-B, MODEL TOWN, LAHORE",MR. MUHAMMAD HAMZA RIAZ - Proprietor,042-35851351,istextile@hotmail.com,TEXTILE MACHINERY & PARTS,TRXTILE MACHINERY PARTS
,DYNAMIC INDUSTRIAL SOLUTIONS,"SUIT NO.411, BLOCK F-1, PAK ARAB SOCIETY, 18- FEROZPUR ROAD, MAIN BOULEVARD, LAHORE",MR. TAJ MUHAMMAD SALIK - Managing Partner,-,infoidslpk@gmail.com,TEXTILE MACHINERY & PARTS,TEXTILE MACHINERY PARTS
,MSA TRADERS,"SUIT # 206, 2ND FLOOR, AL HAFEEZ CENTRE, 89 B-3, GULBERG-III, LAHORE",MR. MUHAMMAD SIKANDAR ALI - Proprietor,-,sikandarali@gmail.com,TEXTILE MACHINERY & PARTS,TEXTILE MACHINERY
,METAL MASTER TRADERS,"GALI MUBARAK WALI, MUHALLA KOT MURAD KHAN, KASUR",MR. HUSNAIN ALI - Proprietor,-,husnainrazaq0786@gmail.com,TEXTILE MACHINERY & PARTS,"TEXTILE MACHINERY PARTS, L-K BOLT, BRASS"
,INTEGRAL MARKETING COMPANY,"HOUSE # 1, STREET # 11, BLOCK A, EDEN VALUES HOMES, MULTAN ROAD, LAHORE",MR. MUHAMMAD SHAHZAD - Proprietor,-,integralm@wol.net.pk,TEXTILE MACHINERY & PARTS,TEXTILE MACHINERY & PARTS
,RAHMAN ENTERPRISES,"689-C, CANAL VIEW HOUSING SOCIETY, LAHORE",MR. SAQIB HABIB KHAN - Managing Partner,042-35299689,iminzi786@yahoo.com,TEXTILE MACHINERY & PARTS,TEXTILE MACHINERY & PARTS
,SHAN ASSOCIATES,"64, F-1, PHASE 1, WAPDA TOWN, LAHORE",RANA SOHAIL AHMAD - Proprietor,"042-35968003, 042-35968004",info@shanassociates.com,TEXTILE MACHINERY & PARTS,TEXTILE MACHINERY
,SHAZI DRESS CO & TRADERS,"7/4, UMER STREET, SANDA KHURD, LAHORE",MR. MUHAMMAD KHALID - Proprietor,-,sd.traders1977@gmail.com,TEXTILE MACHINERY & PARTS,TEXTILE MACHINERY & AUTOMOBILES
,PRUDENT INTERNATIONAL,"46-,53-F RAJA CENTRE, GULBERG-II, LAHORE",MR. HAIDER SALEEM - Proprietor,"042-35716894, 042-35786228",gwipk@yahoo.com,TEXTILE MACHINERY & PARTS,"MACHINERY PARTS, INDUSTRIAL MACHINERY"
,PERFECT SALES & MARKETING,"SUITE NO.1, 4TH FLOOR, AL-HAFEEZ TRADE CENTRE, MODEL TOWN LINK ROAD, LAHORE",SH. NAEEM AHMAD - Proprietor,042-35447336,perfectsm93@hotmail.com,NEW MACHINERY AND PARTS,MACHINERY
