Mship No,Company Name,Address,Name,Ph (Off),Email,Business Sector(s),Business Speciality
,JOYEE SEWING MACHINES (PVT) LTD.,"SHOP # 105, AL SHARIF MARKET, BOHAR WALA CHOWK, LAHORE",MR. MUHAMMAD ASIF - Chief Executive,042-36291888,joyeesewingmachines@gmail.com,SEWING & EMBROIDERY MACHINERES,SEWING MACHINES
,AL FAJAR TRADING COMPANY,"OFF NO.8, SEWING MACHINE MARKET, GUJUMATAH METRO STOP, NEAR CLINX PHARMACY, FEROZPUR ROAD, ROHI NALA, LAHORE",MR. YAWAR ASHFAQ - Proprietor,-,yawarashfaq@gmail.com,SEWING & EMBROIDERY MACHINERES,SEWING MACHINE EMBROIDERY
,VERTEX GLOBAL,"252- MULTAN CHUNGI, MULTAN ROAD, LAHORE",MR. RAMIZ ATIF - Proprietor,042-35252186,vertexglobal.official@gmail.com,SEWING & EMBROIDERY MACHINERES,EMBROIDERY MACHINES & PARTS
,SAMIULLAH TRADERS,"84-T, HABIB ULLAH ROAD, GARHI SHAHU, LAHORE",MR. SAMI ULLAH NAVEED - Proprietor,-,mirzasami531@gmail.com,SEWING & EMBROIDERY MACHINERES,SEWING MACHINES AND PARTS
,ANUM ASSOCIATES,"6-RANA PLAZA, OPP. RASHEED HOSPITAL, KHAYABAN-E-JINAH, D.H.A, CANTT- LAHORE",MR. FAISAL NASEER - Proprietor,-,anumsmc@hotmail.com,SEWING & EMBROIDERY MACHINERES,SEWING & EMBROIDERY MACHINERES
,AL-FATEH ENTERPRISES,"ROOM # 9, IST FLOOR, BILAL CENTER 9- NICHOLSON ROAD, LAHORE",MR. MUNAWAR IJAZ MALIK - Managing Partner,042-36284208,alfatehenterprises@hotmail.com,SEWING & EMBROIDERY MACHINERES,SEWING & EMBROIDERY MACHINERES
,AL-NASR ENTERPRISES,"4-B NAWAB TOWN, RAIWIND ROAD, LAHORE",MR. NISAR AHMAD MUSHTAQ - Managing Partner,042-36291299,alnasr786@gmail.com,SEWING & EMBROIDERY MACHINERES,SEWING MACHINERY & PARTS
,WATAN SEWING MACHINERIES,"6-ALLAMA IQBAL ROAD, NEAR WATAN OPTICAL SERVICE, LAHORE",SYED IRFAN HAIDER - Proprietor,-,syed.irfan.haider1231@gmail.com,SEWING & EMBROIDERY MACHINERES,SEWING MACHINE
