Mship No,Company Name,Address,Name,Ph (Off),Email,Business Sector(s),Business Speciality
NEW-2884,PAK TAI SHAN TRACTORS LTD,THOKAR NIAZ BAIG MULTAN ROAD,,522465,,TRACTORS,TRACTOR
,ZAHID AND COMPANY,"113-D, SUKH CHAIN GARDEN, MULTAN ROAD, LAHORE",MR. ZAHID MAHMOOD - Proprietor,-,mahmoodzahid588@gmail.com,CONTRACTOR,GOVT CONTRACTOR
,ARCH BUILDERS & CONTRACTORS LLP,"80-K, GULBERG-III, LAHORE",MR. MUHAMMAD AHMED REZA MIRZA - Partner,042-35875770,archcontractor4@gmail.com,CONTRACTOR,CONTRACTOR
,UNIVERSAL TRADING COMPANY,"BUILDING 33/1, ABDALI ROAD, SANAT NAGAR, LAHORE",MR. MUHAMMAD ABDULLAH - Proprietor,-,universaltradingcompany86@gmail.com,CONTRACTOR,GENERAL ORDER SUPPLIER
,GLOBAL VISION,"HOUSE NO.635, BLOCK-A, SABZAZAR SCHEME, LAHORE",MR. MUHAMMAD UMAIR NADEEM - Proprietor,-,umairnadeem200@gmail.com,CONTRACTOR,CONTRACTOR
,M RAFI AND SONS CONSTRUCTOR (SMC-PVT) LTD.,"PLOT # 23, TARIQ ISMAIL ROAD, NEAR JUICE FACTORY, RAIWIND ROAD, LAHORE",MR. MUHAMMAD KHURRAM - Director,-,khurramrafi5@gmail.com,CONTRACTOR,CONTRACTOR
,H & H ENGINEERS,"SUITE # 306, 3RD FLOOR, CENTURY TOWER, KALMA CHOWK, MAIN BOULEVARD, GULBERG, LAHORE",MR. MUHAMMAD ABID HUSSAIN - Proprietor,042-35913913,abid123_bwn@hotmail.com,CONTRACTOR,CONTRACTOR
