Mship No,Company Name,Address,Name,Ph (Off),Email,Business Sector(s),Business Speciality
,AGRO GLOBAL,"OFFICE # 108, 4TH FLOOR, MEGA TOWER, 63-B, MAIN BOULEVARD, GULBERG-II, LAHORE",MR. MUHAMMAD HARRIS KHALID - Managing Partner,,agroglobal.pk@gmail.com,VEGETABLES,"POTATOS,MANGO,ONON"
,AGRARIAN WORLD,"1-F, SAMAN BERG, E-BLOCK, JOHAR TOWN, LAHORE",MR. ALI RIAZ CHAUDHARY - Proprietor,,aliriazchaudhary@gmail.com,VEGETABLES,RESH FRUIT AND VEGETABLE EXPORT
,GREEN FRESH FARMS EXPORT (PVT) LTD.,"PLOT # 19, NASHEMAN IQBAL, PHASE-1, LAHORE",MR. MUHAMMAD AHMED HASSAN - Chief Executive,,muhammadahmedhassan1@gmail.com,VEGETABLES,FRUITS
,SINAGRO FARMS,"HOUSE NO.12, BLOCK-G, MODEL TOWN, LAHORE",MR. MUHAMMAD HAROON SIDDIQUE - Managing Partner,042-35884262 042-35884265,umair@sinagrofarms.com,VEGETABLES,FRUITS AND VEGETABLES
,AIMAN ENTERPRISES,"SHOP # 30, NEW SABZI MANDI, RAVI LINK ROAD, LAHORE",MR. MUHAMMAD FAROOQ - Proprietor,,mfarooq132@yahoo.com,VEGETABLES,"TOMATO, ONION, POTATO"
,CH. MUHAMMAD ARIF & SONS,"SHOP#30-A, NEW SABZI MANDI, LINK RAVI ROAD, LAHORE",MR. MUHAMMAD ARIF - Proprietor,,,VEGETABLES,"Onion, Garlic, Tomotto, Potato, Ginger"
,RMB INTERNATIONAL SEED (PVT.) LTD.,"CHOWK MASJID NOOR, SHAHBAZ KHAN ROAD, KASUR",MR. ASHFAQ AHMAD BHATTI - Director,,fabiaseeds@gmail.com,VEGETABLES,VEGETABLE SEEDS / SEEDS PRODUCTION
